qseqid,sseqid,pident,sseq_name
A00470:566:HF2L2DRX3:1:1272:9661:19006_GGGCTACCAG,CP000151.1,95.588,"Burkholderia lata strain 383 chromosome 1, complete sequence"
A00470:566:HF2L2DRX3:1:1272:9661:19006_GGGCTACCAG,CP070977.1,92.857,"Burkholderia pyrrocinia strain Hargis chromosome 1, complete sequence"
A00470:566:HF2L2DRX3:1:1272:9661:19006_GGGCTACCAG,CP086301.1,95.238,"Burkholderia sp. B21-005 chromosome 1, complete sequence"
A00470:566:HF2L2DRX3:1:1273:8504:4883_GATCACGAAG,CP080582.1,93.333,"Weissella confusa strain LM1 chromosome, complete genome"
A00470:566:HF2L2DRX3:1:1273:8504:4883_GATCACGAAG,CP059699.1,93.333,"Weissella cibaria strain CBA3636 chromosome, complete genome"
A00470:566:HF2L2DRX3:1:1273:8504:4883_GATCACGAAG,CP043431.1,92.857,"Weissella koreensis strain SK chromosome, complete genome"
A00470:566:HF2L2DRX3:1:1273:8504:4883_GATCACGAAG,CP060724.1,92.857,"Weissella diestrammenae strain KACC 16890 chromosome, complete genome"
A00470:566:HF2L2DRX3:1:1273:8504:4883_GATCACGAAG,CP002899.1,92.857,"Weissella koreensis KACC 15510, complete genome"
A00470:566:HF2L2DRX3:1:1274:28836:4366_CGGCATCCGT,CP089448.1,100.0,"Klebsiella michiganensis strain 8-1 chromosome, complete genome"
A00470:566:HF2L2DRX3:1:1274:28836:4366_CGGCATCCGT,CP089445.1,100.0,"Escherichia coli strain 5-1 chromosome, complete genome"
A00470:566:HF2L2DRX3:1:1274:28836:4366_CGGCATCCGT,CP089315.1,100.0,"Klebsiella michiganensis strain K92 chromosome, complete genome"
A00470:566:HF2L2DRX3:1:1274:28836:4366_CGGCATCCGT,CP089313.1,100.0,"Salmonella enterica subsp. enterica serovar Indiana strain YZ21MCS4 chromosome, complete genome"
A00470:566:HF2L2DRX3:1:1274:28836:4366_CGGCATCCGT,CP089411.1,100.0,"Klebsiella oxytoca strain Kox100 chromosome, complete genome"
A00470:566:HF2L2DRX3:1:2130:14136:27101_CGGCCACAAC,GU925484.1,94.937,"Uncultured bacterium clone F5K2Q4C04JRRFF 23S ribosomal RNA gene, partial sequence"
A00470:566:HF2L2DRX3:1:2130:14136:27101_CGGCCACAAC,GU925343.1,94.937,"Uncultured bacterium clone F5K2Q4C04I3I99 23S ribosomal RNA gene, partial sequence"
A00470:566:HF2L2DRX3:1:2130:14136:27101_CGGCCACAAC,CP076366.1,90.0,"Gemmobacter fulvus strain con5 plasmid p5, complete sequence"
A00470:566:HF2L2DRX3:1:2130:14136:27101_CGGCCACAAC,CP076361.1,90.0,"Gemmobacter fulvus strain con5 chromosome, complete genome"
A00470:566:HF2L2DRX3:1:2130:14597:24831_CTCAAGCAAG,CP088237.1,100.0,Ralstonia solanacearum strain UW251 chromosome
A00470:566:HF2L2DRX3:1:2130:14597:24831_CTCAAGCAAG,CP088235.1,100.0,Ralstonia solanacearum strain CIP417_UW70 chromosome
A00470:566:HF2L2DRX3:1:2130:14597:24831_CTCAAGCAAG,CP088233.1,100.0,Ralstonia solanacearum strain UW72 chromosome
A00470:566:HF2L2DRX3:1:2130:14597:24831_CTCAAGCAAG,MW468047.1,100.0,"Uncultured bacterium clone V6926 16S ribosomal RNA gene, partial sequence; 16S-23S ribosomal RNA intergenic spacer, complete sequence; and 23S ribosomal RNA gene, partial sequence"
A00470:566:HF2L2DRX3:1:2130:14597:24831_CTCAAGCAAG,MW468046.1,100.0,"Uncultured bacterium clone YCJ859 16S ribosomal RNA gene, partial sequence; 16S-23S ribosomal RNA intergenic spacer, complete sequence; and 23S ribosomal RNA gene, partial sequence"
A00470:566:HF2L2DRX3:1:1243:28854:35869_GGGGGCAATA,CP050302.1,100.0,"Phyllobacterium sp. 628 plasmid p_2, complete sequence"
A00470:566:HF2L2DRX3:1:1243:28854:35869_GGGGGCAATA,CP050301.1,100.0,"Phyllobacterium sp. 628 chromosome, complete genome"
A00470:566:HF2L2DRX3:1:1243:28854:35869_GGGGGCAATA,CP073110.1,98.718,"Rhizobium rhizogenes strain A4 chromosome 1, complete sequence"
A00470:566:HF2L2DRX3:1:1243:28854:35869_GGGGGCAATA,CP049213.1,98.718,"Rhizobium rhizogenes strain CA75/95 chromosome 1, complete sequence"
A00470:566:HF2L2DRX3:1:1243:28854:35869_GGGGGCAATA,NR_076491.1,98.718,"Agrobacterium tumefaciens strain K84 23S ribosomal RNA gene, complete sequence"
A00470:566:HF2L2DRX3:1:1274:9480:27085_GAACCAACAT,JX406004.1,98.077,"Uncultured marine bacterium clone S21-141 16S ribosomal RNA gene, partial sequence"
A00470:566:HF2L2DRX3:1:1274:9480:27085_GAACCAACAT,JX405884.1,98.077,"Uncultured marine bacterium clone S10-16 16S ribosomal RNA gene, partial sequence"
A00470:566:HF2L2DRX3:1:1274:9480:27085_GAACCAACAT,JX405666.1,98.077,"Uncultured marine bacterium clone B21-136 16S ribosomal RNA gene, partial sequence"
A00470:566:HF2L2DRX3:1:1274:9480:27085_GAACCAACAT,JX405664.1,98.077,"Uncultured marine bacterium clone B21-133 16S ribosomal RNA gene, partial sequence"
A00470:566:HF2L2DRX3:1:1274:9480:27085_GAACCAACAT,HG764278.1,98.113,"Uncultured endophytic bacterium partial 16S rRNA gene, isolate HsBG17"
A00470:566:HF2L2DRX3:1:1275:32533:12242_TTAGACACAG,CP088274.1,100.0,"Phyllobacterium sp. T1293 plasmid pT1293c, complete sequence"
A00470:566:HF2L2DRX3:1:1275:32533:12242_TTAGACACAG,CP088273.1,100.0,"Phyllobacterium sp. T1293 chromosome, complete genome"
A00470:566:HF2L2DRX3:1:1275:32533:12242_TTAGACACAG,NR_121848.1,100.0,"Brucella ceti TE10759-12 5S ribosomal RNA, complete sequence"
A00470:566:HF2L2DRX3:1:1275:32533:12242_TTAGACACAG,CP007696.1,100.0,"Brucella suis bv. 2 strain Bs143CITA chromosome II, complete sequence"
A00470:566:HF2L2DRX3:1:1275:32533:12242_TTAGACACAG,CP007695.1,100.0,"Brucella suis bv. 2 strain Bs143CITA chromosome I, complete sequence"
A00470:566:HF2L2DRX3:1:1277:25111:26381_CCCCCCATAC,LC661721.1,100.0,"Burkholderia sp. JA10 gene for 16S rRNA, partial sequence"
A00470:566:HF2L2DRX3:1:1277:25111:26381_CCCCCCATAC,OL469786.1,100.0,"Burkholderia cepacia 16S ribosomal RNA gene, partial sequence"
A00470:566:HF2L2DRX3:1:1277:25111:26381_CCCCCCATAC,KJ672506.1,100.0,"Burkholderia sp. D412 16S ribosomal RNA gene, partial sequence"
A00470:566:HF2L2DRX3:1:1277:25111:26381_CCCCCCATAC,KJ672505.1,100.0,"Burkholderia sp. D416 16S ribosomal RNA gene, partial sequence"
A00470:566:HF2L2DRX3:1:1277:25111:26381_CCCCCCATAC,KJ725085.1,100.0,"Burkholderia sp. SD001 16S ribosomal RNA gene, partial sequence"
A00470:566:HF2L2DRX3:1:1277:4761:9612_CATTCACCAA,GU924303.1,100.0,"Uncultured bacterium clone F5K2Q4C04JCZFC 23S ribosomal RNA gene, partial sequence"
A00470:566:HF2L2DRX3:1:1277:4761:9612_CATTCACCAA,GU923754.1,100.0,"Uncultured bacterium clone F5K2Q4C04JFLGB 23S ribosomal RNA gene, partial sequence"
A00470:566:HF2L2DRX3:1:1277:4761:9612_CATTCACCAA,CP069157.1,98.734,"Morganella morganii strain DSM 30164 chromosome, complete genome"
A00470:566:HF2L2DRX3:1:1277:4761:9612_CATTCACCAA,CP076116.1,98.734,"Ralstonia solanacearum strain Rs-SY1 plasmid unnamed1, complete sequence"
A00470:566:HF2L2DRX3:1:1277:4761:9612_CATTCACCAA,CP003730.1,98.718,"Legionella pneumophila subsp. pneumophila str. Thunder Bay, complete genome"
A00470:566:HF2L2DRX3:1:1278:10402:6699_TCCAACCTCT,CP089448.1,97.101,"Klebsiella michiganensis strain 8-1 chromosome, complete genome"
A00470:566:HF2L2DRX3:1:1278:10402:6699_TCCAACCTCT,CP089445.1,97.101,"Escherichia coli strain 5-1 chromosome, complete genome"
A00470:566:HF2L2DRX3:1:1278:10402:6699_TCCAACCTCT,CP089385.1,97.101,"Klebsiella variicola subsp. variicola strain KPN692 chromosome, complete genome"
A00470:566:HF2L2DRX3:1:1278:10402:6699_TCCAACCTCT,CP089315.1,97.101,"Klebsiella michiganensis strain K92 chromosome, complete genome"
A00470:566:HF2L2DRX3:1:1278:10402:6699_TCCAACCTCT,CP089313.1,97.101,"Salmonella enterica subsp. enterica serovar Indiana strain YZ21MCS4 chromosome, complete genome"
A00470:566:HF2L2DRX3:1:1278:3911:11804_CCCGACGAGG,CP068263.2,98.75,Homo sapiens isolate CHM13 chromosome 15
A00470:566:HF2L2DRX3:1:1278:3911:11804_CCCGACGAGG,AC243951.3,98.75,"Homo sapiens BAC clone CH17-71L23 from chromosome unknown, complete sequence"
A00470:566:HF2L2DRX3:1:1278:3911:11804_CCCGACGAGG,AP023475.1,98.75,"Homo sapiens DNA, chromosome 15, nearly complete genome"
A00470:566:HF2L2DRX3:1:1278:3911:11804_CCCGACGAGG,AC280103.1,98.75,"Homo sapiens chromosome unknown clone CH17-223N18, complete sequence"
A00470:566:HF2L2DRX3:1:1278:3911:11804_CCCGACGAGG,AC243657.2,98.75,"Homo sapiens BAC clone CH17-169A12 from chromosome unknown, complete sequence"
A00470:566:HF2L2DRX3:1:1278:9697:24455_CGGCCTCGCC,CP083740.1,93.443,"Bremerella volcania strain TYQ1 chromosome, complete genome"
A00470:566:HF2L2DRX3:1:1278:9697:24455_CGGCCTCGCC,NR_076710.1,90.476,"Pirellula staleyi strain DSM 6068 23S ribosomal RNA gene, complete sequence"
A00470:566:HF2L2DRX3:1:1278:9697:24455_CGGCCTCGCC,CP001848.1,90.476,"Pirellula staleyi DSM 6068 chromosome, complete genome"
A00470:566:HF2L2DRX3:1:1278:9697:24455_CGGCCTCGCC,AF245368.1,90.476,"Pirellula staleyi 23S ribosomal RNA gene, partial sequence"
A00470:566:HF2L2DRX3:1:1278:9697:24455_CGGCCTCGCC,AF245367.1,91.667,"Pirellula marina 23S ribosomal RNA gene, partial sequence"
A00470:566:HF2L2DRX3:1:2134:6334:13526_CGATCCCACG,NG_023247.1,92.647,"Homo sapiens guanine monophosphate synthase (GMPS), RefSeqGene on chromosome 3"
A00470:566:HF2L2DRX3:1:2134:6334:13526_CGATCCCACG,AC104472.14,92.647,Homo sapiens 3 BAC RP11-674E16 (Roswell Park Cancer Institute Human BAC Library) complete sequence
A00470:566:HF2L2DRX3:1:1251:27977:13839_AACAAACAAA,HG938371.2,100.0,"Burkholderia cenocepacia H111 chromosome 2, complete genome"
A00470:566:HF2L2DRX3:1:1251:27977:13839_AACAAACAAA,CP086305.1,100.0,"Burkholderia ambifaria strain B21-004 chromosome 2, complete sequence"
A00470:566:HF2L2DRX3:1:1251:27977:13839_AACAAACAAA,CP086304.1,100.0,"Burkholderia ambifaria strain B21-004 chromosome 1, complete sequence"
A00470:566:HF2L2DRX3:1:1251:27977:13839_AACAAACAAA,CP085997.1,100.0,"Burkholderia vietnamiensis strain FDAARGOS_1590 chromosome 2, complete sequence"
A00470:566:HF2L2DRX3:1:1251:27977:13839_AACAAACAAA,CP085996.1,100.0,"Burkholderia vietnamiensis strain FDAARGOS_1590 chromosome 1, complete sequence"
A00470:566:HF2L2DRX3:1:1252:15167:21527_AAGGGCACTT,AP025032.1,96.154,"Aureimonas sp. SA4125 DNA, complete genome"
A00470:566:HF2L2DRX3:1:1252:15167:21527_AAGGGCACTT,CP072611.1,96.154,"Aureimonas populi strain KCTC 42087 chromosome, complete genome"
A00470:566:HF2L2DRX3:1:1252:15167:21527_AAGGGCACTT,NR_076614.1,96.154,"Methylocella silvestris strain BL2 23S ribosomal RNA gene, complete sequence"
A00470:566:HF2L2DRX3:1:1252:15167:21527_AAGGGCACTT,NR_076571.1,96.154,"Beijerinckia indica subsp. indica strain Delft E.III.12.1.1 23S ribosomal RNA gene, complete sequence"
A00470:566:HF2L2DRX3:1:1252:15167:21527_AAGGGCACTT,AP024269.1,96.154,"Kaistia sp. 32K DNA, complete genome"
A00470:566:HF2L2DRX3:1:1252:18927:31548_GACACTGCCA,OL639013.1,100.0,"Uncultured bacterium clone PS_Site3_LRC-2 16S ribosomal RNA gene, partial sequence; 16S-23S ribosomal RNA intergenic spacer, complete sequence; and 23S ribosomal RNA gene, partial sequence"
A00470:566:HF2L2DRX3:1:1252:18927:31548_GACACTGCCA,OL639012.1,100.0,"Uncultured bacterium clone PS_Site3_LRC-1 16S ribosomal RNA gene, partial sequence; 16S-23S ribosomal RNA intergenic spacer, complete sequence; and 23S ribosomal RNA gene, partial sequence"
A00470:566:HF2L2DRX3:1:1252:18927:31548_GACACTGCCA,OL639011.1,100.0,"Uncultured bacterium clone PS_Site2_3_LRC-2 16S ribosomal RNA gene, partial sequence; 16S-23S ribosomal RNA intergenic spacer, complete sequence; and 23S ribosomal RNA gene, partial sequence"
A00470:566:HF2L2DRX3:1:1252:18927:31548_GACACTGCCA,OL639010.1,100.0,"Uncultured bacterium clone PS_Site2_3_LRC-1 16S ribosomal RNA gene, partial sequence; 16S-23S ribosomal RNA intergenic spacer, complete sequence; and 23S ribosomal RNA gene, partial sequence"
A00470:566:HF2L2DRX3:1:1252:18927:31548_GACACTGCCA,OL639008.1,100.0,"Uncultured bacterium clone PET_Site1_LRC_2 16S ribosomal RNA gene, partial sequence; 16S-23S ribosomal RNA intergenic spacer, complete sequence; and 23S ribosomal RNA gene, partial sequence"
A00470:566:HF2L2DRX3:1:2102:5421:31234_TAACCAACAA,CP075192.1,100.0,"Ferribacterium limneticum strain 132 chromosome, complete genome"
A00470:566:HF2L2DRX3:1:2102:5421:31234_TAACCAACAA,CP075191.1,100.0,"Ferribacterium limneticum strain 128 chromosome, complete genome"
A00470:566:HF2L2DRX3:1:2102:5421:31234_TAACCAACAA,CP075189.1,100.0,"Ferribacterium limneticum strain 77 chromosome, complete genome"
A00470:566:HF2L2DRX3:1:2102:5421:31234_TAACCAACAA,NR_076369.1,100.0,"Dechloromonas aromatica strain RCB 23S ribosomal RNA gene, complete sequence"
A00470:566:HF2L2DRX3:1:2102:5421:31234_TAACCAACAA,OU015322.1,98.701,"MAG: uncultured Rhodocyclaceae bacterium isolate DEC001_d71 genome assembly, chromosome: contig1"
A00470:566:HF2L2DRX3:1:2104:26982:19132_TTGGCCATAC,CP046179.1,95.946,MAG: Boseongicola sp. isolate MH-Pat-all_autometa_1-3 chromosome
A00470:566:HF2L2DRX3:1:2104:26982:19132_TTGGCCATAC,CP051232.1,95.89,MAG: Maritimibacter sp. isolate ih11 chromosome
A00470:566:HF2L2DRX3:1:2104:26982:19132_TTGGCCATAC,CP051251.1,90.411,MAG: Pseudooceanicola nitratireducens isolate m3 chromosome
A00470:566:HF2L2DRX3:1:2104:26982:19132_TTGGCCATAC,GU926543.1,87.879,"Uncultured bacterium clone F5K2Q4C04JS0MZ 23S ribosomal RNA gene, partial sequence"
A00470:566:HF2L2DRX3:1:2104:26982:19132_TTGGCCATAC,GU924368.1,87.879,"Uncultured bacterium clone F5K2Q4C04IRBT5 23S ribosomal RNA gene, partial sequence"
A00470:566:HF2L2DRX3:1:2104:5638:30201_TTGAGTTGGG,CP088081.1,100.0,"Ideonella dechloratans strain CCUG 30977 chromosome, complete genome"
A00470:566:HF2L2DRX3:1:2104:5638:30201_TTGAGTTGGG,AP014569.1,100.0,"Serpentinomonas mccroryi DNA, complete genome"
A00470:566:HF2L2DRX3:1:2104:5638:30201_TTGAGTTGGG,AP014568.1,100.0,"Serpentinomonas raichei DNA, complete genome"
A00470:566:HF2L2DRX3:1:2104:5638:30201_TTGAGTTGGG,CP086023.1,100.0,"Paracidovorax citrulli strain HPP21-3-3B chromosome, complete genome"
A00470:566:HF2L2DRX3:1:2104:5638:30201_TTGAGTTGGG,CP086060.1,98.113,"Paracidovorax citrulli strain HPP21-9-4B chromosome, complete genome"
A00470:566:HF2L2DRX3:1:2105:10791:34648_TGCGCGCTAC,CP089128.1,100.0,Saccharomyces cerevisiae strain S288C-SK1-cross isolate tetrad 8 spore a chromosome XII
A00470:566:HF2L2DRX3:1:2105:10791:34648_TGCGCGCTAC,CP089111.1,100.0,Saccharomyces cerevisiae strain S288C-SK1-cross isolate tetrad 12 spore a chromosome XII
A00470:566:HF2L2DRX3:1:2105:10791:34648_TGCGCGCTAC,CP088321.1,100.0,Saccharomyces cerevisiae strain F chromosome XII
A00470:566:HF2L2DRX3:1:2105:10791:34648_TGCGCGCTAC,CP088312.1,100.0,Saccharomyces cerevisiae strain A chromosome XII
A00470:566:HF2L2DRX3:1:2105:10791:34648_TGCGCGCTAC,OL659291.1,100.0,"Meyerozyma guilliermondii strain YK22 small subunit ribosomal RNA gene, partial sequence"
A00470:566:HF2L2DRX3:1:2138:25211:16188_AAAACTAGAC,MZ710036.1,98.718,"Oligochaeta sp. LKW085 small subunit ribosomal RNA gene, partial sequence"
A00470:566:HF2L2DRX3:1:2138:25211:16188_AAAACTAGAC,MW794271.1,98.718,"Heterodrilus sp. n. JL-2021 isolate 5_A small subunit ribosomal RNA gene, partial sequence"
A00470:566:HF2L2DRX3:1:2138:25211:16188_AAAACTAGAC,MW794269.1,98.718,"Heterodrilus sp. n. JL-2021 isolate 3_A small subunit ribosomal RNA gene, partial sequence"
A00470:566:HF2L2DRX3:1:2138:25211:16188_AAAACTAGAC,MW794268.1,98.718,"Heterodrilus sp. n. JL-2021 isolate 2_A small subunit ribosomal RNA gene, partial sequence"
A00470:566:HF2L2DRX3:1:2138:25211:16188_AAAACTAGAC,MW794267.1,98.718,"Heterodrilus sp. n. JL-2021 isolate 1_A small subunit ribosomal RNA gene, partial sequence"
A00470:566:HF2L2DRX3:1:2139:32597:12195_CACACCGATT,CP089448.1,100.0,"Klebsiella michiganensis strain 8-1 chromosome, complete genome"
A00470:566:HF2L2DRX3:1:2139:32597:12195_CACACCGATT,CP089445.1,100.0,"Escherichia coli strain 5-1 chromosome, complete genome"
A00470:566:HF2L2DRX3:1:2139:32597:12195_CACACCGATT,CP089385.1,100.0,"Klebsiella variicola subsp. variicola strain KPN692 chromosome, complete genome"
A00470:566:HF2L2DRX3:1:2139:32597:12195_CACACCGATT,CP089315.1,100.0,"Klebsiella michiganensis strain K92 chromosome, complete genome"
A00470:566:HF2L2DRX3:1:2139:32597:12195_CACACCGATT,CP089313.1,100.0,"Salmonella enterica subsp. enterica serovar Indiana strain YZ21MCS4 chromosome, complete genome"
A00470:566:HF2L2DRX3:1:1255:26982:33505_TCACACAACG,OL639006.1,100.0,"Uncultured bacterium clone Microplastics_LRC_5 16S ribosomal RNA gene, partial sequence; 16S-23S ribosomal RNA intergenic spacer, complete sequence; and 23S ribosomal RNA gene, partial sequence"
A00470:566:HF2L2DRX3:1:1255:26982:33505_TCACACAACG,OL639004.1,100.0,"Uncultured bacterium clone Microplastics_LRC_3 16S ribosomal RNA gene, partial sequence; 16S-23S ribosomal RNA intergenic spacer, complete sequence; and 23S ribosomal RNA gene, partial sequence"
A00470:566:HF2L2DRX3:1:1255:26982:33505_TCACACAACG,OL639003.1,100.0,"Uncultured bacterium clone Microplastics_LRC_2 16S ribosomal RNA gene, partial sequence; 16S-23S ribosomal RNA intergenic spacer, complete sequence; and 23S ribosomal RNA gene, partial sequence"
A00470:566:HF2L2DRX3:1:1255:26982:33505_TCACACAACG,OL639002.1,100.0,"Uncultured bacterium clone Microplastics_LRC_1 16S ribosomal RNA gene, partial sequence; 16S-23S ribosomal RNA intergenic spacer, complete sequence; and 23S ribosomal RNA gene, partial sequence"
A00470:566:HF2L2DRX3:1:1255:26982:33505_TCACACAACG,OL639000.1,100.0,"Uncultured bacterium clone HDPE_Site1_LRC_2 16S ribosomal RNA gene, partial sequence; 16S-23S ribosomal RNA intergenic spacer, complete sequence; and 23S ribosomal RNA gene, partial sequence"
A00470:566:HF2L2DRX3:1:2111:6813:11005_CAGAGCAAAC,CP083452.1,98.701,"Comamonas odontotermitis strain WLL plasmid unnamed1, complete sequence"
A00470:566:HF2L2DRX3:1:2111:6813:11005_CAGAGCAAAC,CP083451.1,98.701,"Comamonas odontotermitis strain WLL chromosome, complete genome"
A00470:566:HF2L2DRX3:1:2111:6813:11005_CAGAGCAAAC,CP088081.1,97.403,"Ideonella dechloratans strain CCUG 30977 chromosome, complete genome"
A00470:566:HF2L2DRX3:1:2111:6813:11005_CAGAGCAAAC,CP083911.1,97.403,"Tepidimonas taiwanensis strain LMG 22826 chromosome, complete genome"
A00470:566:HF2L2DRX3:1:2111:6813:11005_CAGAGCAAAC,CP059067.1,97.403,Rhizobacter sp. AJA081-3 chromosome
A00470:566:HF2L2DRX3:1:2112:11541:36824_GCCAAGCAGG,KF845767.1,100.0,"Uncultured bacterium clone RKtaTu2914 16S ribosomal RNA gene, partial sequence"
A00470:566:HF2L2DRX3:1:2112:11541:36824_GCCAAGCAGG,KF845762.1,100.0,"Uncultured bacterium clone RKtaTu2905 16S ribosomal RNA gene, partial sequence"
A00470:566:HF2L2DRX3:1:2112:11541:36824_GCCAAGCAGG,KF845748.1,100.0,"Uncultured bacterium clone RKtaTu2880 16S ribosomal RNA gene, partial sequence"
A00470:566:HF2L2DRX3:1:2112:11541:36824_GCCAAGCAGG,KF721538.1,100.0,"Uncultured Arcobacter sp. clone DVASW_D150 16S ribosomal RNA gene, partial sequence"
A00470:566:HF2L2DRX3:1:2112:11541:36824_GCCAAGCAGG,KF721534.1,100.0,"Uncultured Arcobacter sp. clone DVASW_D145 16S ribosomal RNA gene, partial sequence"
A00470:566:HF2L2DRX3:1:2112:17598:35164_GCGGGCTGCG,HQ845896.1,94.805,"Uncultured bacterium clone HK_RBC20 16S ribosomal RNA gene, partial sequence"
A00470:566:HF2L2DRX3:1:2112:17598:35164_GCGGGCTGCG,JQ086945.1,93.59,"Uncultured Polyangiaceae bacterium clone 2_100_H1_b 16S ribosomal RNA gene, partial sequence"
A00470:566:HF2L2DRX3:1:2112:17598:35164_GCGGGCTGCG,JN571817.1,93.59,"Uncultured bacterium clone 55b-14t-1 16S ribosomal RNA gene, partial sequence"
A00470:566:HF2L2DRX3:1:2112:17598:35164_GCGGGCTGCG,JN387319.1,93.59,"Uncultured microorganism clone Group9_a 16S ribosomal RNA gene, partial sequence"
A00470:566:HF2L2DRX3:1:2112:17598:35164_GCGGGCTGCG,JQ311834.1,93.506,"Uncultured bacterium clone OTU80-21 16S ribosomal RNA gene, partial sequence"
A00470:566:HF2L2DRX3:1:2112:17888:2253_ATTGAAAGTA,CP088968.1,100.0,Janthinobacterium sp. PLB04 chromosome
A00470:566:HF2L2DRX3:1:2112:17888:2253_ATTGAAAGTA,CP047396.1,100.0,"Candidatus Vallotia cooleyia isolate 19-005_Vallotia chromosome, complete genome"
A00470:566:HF2L2DRX3:1:2112:17888:2253_ATTGAAAGTA,CP083911.1,100.0,"Tepidimonas taiwanensis strain LMG 22826 chromosome, complete genome"
A00470:566:HF2L2DRX3:1:2112:17888:2253_ATTGAAAGTA,KF422130.1,100.0,Uncultured Acidovorax sp. clone VostokV6_rep_c124 genomic sequence
A00470:566:HF2L2DRX3:1:2112:17888:2253_ATTGAAAGTA,HG322949.1,100.0,"Janthinobacterium agaricidamnosum NBRC 102515 = DSM 9628, complete genome"
A00470:566:HF2L2DRX3:1:2113:6524:4492_GATCGCACCT,CP088292.1,100.0,"Phyllobacterium sp. T1018 chromosome, complete genome"
A00470:566:HF2L2DRX3:1:2113:6524:4492_GATCGCACCT,CP088274.1,100.0,"Phyllobacterium sp. T1293 plasmid pT1293c, complete sequence"
A00470:566:HF2L2DRX3:1:2113:6524:4492_GATCGCACCT,CP088273.1,100.0,"Phyllobacterium sp. T1293 chromosome, complete genome"
A00470:566:HF2L2DRX3:1:2113:6524:4492_GATCGCACCT,CP066786.1,100.0,"Martelella lutilitoris strain ZRK001 chromosome, complete genome"
A00470:566:HF2L2DRX3:1:2113:6524:4492_GATCGCACCT,OB742195.1,100.0,Cyprideis torosa
A00470:566:HF2L2DRX3:1:2115:10276:27054_ATACGCCTTG,CP080582.1,100.0,"Weissella confusa strain LM1 chromosome, complete genome"
A00470:566:HF2L2DRX3:1:2115:10276:27054_ATACGCCTTG,CP059699.1,100.0,"Weissella cibaria strain CBA3636 chromosome, complete genome"
A00470:566:HF2L2DRX3:1:2115:10276:27054_ATACGCCTTG,X68035.1,100.0,Weissella confusa gene for 23S rRNA
A00470:566:HF2L2DRX3:1:2115:10276:27054_ATACGCCTTG,CP075544.1,98.734,"Weissella tructae strain W-1 chromosome, complete genome"
A00470:566:HF2L2DRX3:1:2115:10276:27054_ATACGCCTTG,CP074441.1,98.734,"Weissella ceti strain CECT 7719 chromosome, complete genome"
A00470:566:HF2L2DRX3:1:2143:9815:23500_CACCCTACTA,CP089445.1,100.0,"Escherichia coli strain 5-1 chromosome, complete genome"
A00470:566:HF2L2DRX3:1:2143:9815:23500_CACCCTACTA,OL826824.1,100.0,"Escherichia coli strain Samah 2021 16S ribosomal RNA gene, partial sequence"
A00470:566:HF2L2DRX3:1:2143:9815:23500_CACCCTACTA,OL824933.1,100.0,"Serratia marcescens strain ST212 16S ribosomal RNA gene, partial sequence"
A00470:566:HF2L2DRX3:1:2143:9815:23500_CACCCTACTA,OL824932.1,100.0,"Serratia marcescens strain ST118 16S ribosomal RNA gene, partial sequence"
A00470:566:HF2L2DRX3:1:2143:9815:23500_CACCCTACTA,OL824929.1,100.0,"Serratia marcescens strain SL213 16S ribosomal RNA gene, partial sequence"
A00470:566:HF2L2DRX3:1:1246:31250:18850_CGCTGCCCTC,KJ638982.1,100.0,"Chryseobacterium indologenes strain ALR-13 16S ribosomal RNA gene, partial sequence"
A00470:566:HF2L2DRX3:1:1246:31250:18850_CGCTGCCCTC,KJ806496.1,100.0,"Chryseobacterium jejuense strain C-B10D 16S ribosomal RNA gene, partial sequence"
A00470:566:HF2L2DRX3:1:1246:31250:18850_CGCTGCCCTC,KJ806472.1,100.0,"Chryseobacterium jejuense strain S-B5B 16S ribosomal RNA gene, partial sequence"
A00470:566:HF2L2DRX3:1:1246:31250:18850_CGCTGCCCTC,MZ430213.1,100.0,"Chryseobacterium candidae strain ET7 16S ribosomal RNA gene, partial sequence"
A00470:566:HF2L2DRX3:1:1246:31250:18850_CGCTGCCCTC,MZ575128.1,100.0,"Chryseobacterium bernardetii strain INV BAC18 16S ribosomal RNA gene, partial sequence"
A00470:566:HF2L2DRX3:1:2105:9616:3865_ACAGTCTGCG,AB861537.1,100.0,"Rickettsiaceae endosymbiont of Volvox carteri gene for 16S ribosomal RNA, partial sequence"
A00470:566:HF2L2DRX3:1:2105:9616:3865_ACAGTCTGCG,CP084576.1,100.0,"MAG: Candidatus Megaira endosymbiont of Mesostigma viride isolate MegNEIS296 chromosome, complete genome"
A00470:566:HF2L2DRX3:1:2105:9616:3865_ACAGTCTGCG,HE647657.1,100.0,"Uncultured bacterium partial 16S rRNA gene, clone 28b"
A00470:566:HF2L2DRX3:1:2105:9616:3865_ACAGTCTGCG,KC666974.1,100.0,"Uncultured bacterium clone FL_05_178 16S ribosomal RNA gene, partial sequence"
A00470:566:HF2L2DRX3:1:2105:9616:3865_ACAGTCTGCG,FR822997.2,100.0,Endosymbiont of Paramecium caudatum SH42 partial 16S rRNA gene
A00470:566:HF2L2DRX3:1:2106:9200:2362_CGCCTTAAAG,CP089303.1,100.0,"Limosilactobacillus reuteri strain VHProbi M07 chromosome, complete genome"
A00470:566:HF2L2DRX3:1:2106:9200:2362_CGCCTTAAAG,CP088931.1,100.0,"Limosilactobacillus reuteri strain VHProbi E18 chromosome, complete genome"
A00470:566:HF2L2DRX3:1:2106:9200:2362_CGCCTTAAAG,CP065849.1,100.0,Limosilactobacillus reuteri isolate 3632 chromosome
A00470:566:HF2L2DRX3:1:2106:9200:2362_CGCCTTAAAG,CP065330.1,100.0,Limosilactobacillus reuteri isolate 3630 chromosome
A00470:566:HF2L2DRX3:1:2106:9200:2362_CGCCTTAAAG,AP011541.2,100.0,"Bacillus subtilis subsp. natto BEST195 DNA, complete genome"
A00470:566:HF2L2DRX3:1:2108:18439:19836_AACAAAATAA,CP089128.1,100.0,Saccharomyces cerevisiae strain S288C-SK1-cross isolate tetrad 8 spore a chromosome XII
A00470:566:HF2L2DRX3:1:2108:18439:19836_AACAAAATAA,CP089111.1,100.0,Saccharomyces cerevisiae strain S288C-SK1-cross isolate tetrad 12 spore a chromosome XII
A00470:566:HF2L2DRX3:1:2108:18439:19836_AACAAAATAA,CP088321.1,100.0,Saccharomyces cerevisiae strain F chromosome XII
A00470:566:HF2L2DRX3:1:2108:18439:19836_AACAAAATAA,CP088312.1,100.0,Saccharomyces cerevisiae strain A chromosome XII
A00470:566:HF2L2DRX3:1:2108:18439:19836_AACAAAATAA,7OSA_25S,100.0,"Chain 25S, 25S rRNA"
A00470:566:HF2L2DRX3:1:2108:22950:23234_TAGCACCCGA,CP075184.1,100.0,"Acidovorax radicis strain 79 chromosome, complete genome"
A00470:566:HF2L2DRX3:1:2108:22950:23234_TAGCACCCGA,CP083452.1,100.0,"Comamonas odontotermitis strain WLL plasmid unnamed1, complete sequence"
A00470:566:HF2L2DRX3:1:2108:22950:23234_TAGCACCCGA,CP083451.1,100.0,"Comamonas odontotermitis strain WLL chromosome, complete genome"
A00470:566:HF2L2DRX3:1:2108:22950:23234_TAGCACCCGA,CP079745.1,100.0,"Comamonas aquatica strain B1 chromosome, complete genome"
A00470:566:HF2L2DRX3:1:2108:22950:23234_TAGCACCCGA,CP049795.1,100.0,"Delftia sp. WY8 chromosome, complete genome"
A00470:566:HF2L2DRX3:1:2108:28944:2174_CCCCCCCCCA,MW843503.1,97.778,"Salpingoeca llamariensis strain HFCC983 large subunit ribosomal RNA gene, partial sequence"
A00470:566:HF2L2DRX3:1:2108:28944:2174_CCCCCCCCCA,MW843502.1,97.778,"Salpingoeca llamariensis strain HFCC957 large subunit ribosomal RNA gene, partial sequence"
A00470:566:HF2L2DRX3:1:2108:28944:2174_CCCCCCCCCA,AY026380.1,97.778,"Salpingoeca infusionum 28S large subunit ribosomal RNA gene, partial sequence"
