qseqid,sseqid,pident,sseq_name
A00470:566:HF2L2DRX3:1:2241:12707:31422_TGGCATTCGG,KF927682.1,100.0,"Uncultured bacterium clone MD272 16S ribosomal RNA gene, partial sequence"
A00470:566:HF2L2DRX3:1:2241:12707:31422_TGGCATTCGG,KJ707384.1,100.0,"Uncultured bacterium clone QKAC2ZG081 16S ribosomal RNA gene, partial sequence"
A00470:566:HF2L2DRX3:1:2275:27642:11851_GACCACCAAG,CP087990.1,95.181,"Comamonadaceae bacterium M7527 chromosome, complete genome"
A00470:566:HF2L2DRX3:1:2275:27642:11851_GACCACCAAG,CP086023.1,95.181,"Paracidovorax citrulli strain HPP21-3-3B chromosome, complete genome"
A00470:566:HF2L2DRX3:1:2275:27642:11851_GACCACCAAG,CP086060.1,95.181,"Paracidovorax citrulli strain HPP21-9-4B chromosome, complete genome"
A00470:566:HF2L2DRX3:1:2275:27642:11851_GACCACCAAG,CP075184.1,95.181,"Acidovorax radicis strain 79 chromosome, complete genome"
A00470:566:HF2L2DRX3:1:2275:27642:11851_GACCACCAAG,CP080761.1,95.181,"Diaphorobacter sp. MNS-0 chromosome, complete genome"
A00470:566:HF2L2DRX3:1:2275:4743:28808_CCCAACACCC,OL639010.1,98.113,"Uncultured bacterium clone PS_Site2_3_LRC-1 16S ribosomal RNA gene, partial sequence; 16S-23S ribosomal RNA intergenic spacer, complete sequence; and 23S ribosomal RNA gene, partial sequence"
A00470:566:HF2L2DRX3:1:2275:4743:28808_CCCAACACCC,AP025193.1,98.113,"Comamonas thiooxydans NR4028 DNA, complete genome"
A00470:566:HF2L2DRX3:1:2275:4743:28808_CCCAACACCC,CP075192.1,98.113,"Ferribacterium limneticum strain 132 chromosome, complete genome"
A00470:566:HF2L2DRX3:1:2275:4743:28808_CCCAACACCC,CP075191.1,98.113,"Ferribacterium limneticum strain 128 chromosome, complete genome"
A00470:566:HF2L2DRX3:1:2275:4743:28808_CCCAACACCC,CP075190.1,98.113,"Ferribacterium limneticum strain 76 chromosome, complete genome"
A00470:566:HF2L2DRX3:1:2275:7374:2174_AAGAACTCAG,EF220476.1,100.0,"Uncultured alpha proteobacterium clone Fl-1F_B05 16S ribosomal RNA gene, partial sequence"
A00470:566:HF2L2DRX3:1:2275:7374:2174_AAGAACTCAG,KF115502.1,100.0,"Uncultured Amaricoccus sp. clone GY29W4J02JYMES 16S ribosomal RNA gene, partial sequence"
A00470:566:HF2L2DRX3:1:2275:7374:2174_AAGAACTCAG,KF336866.1,100.0,"Uncultured bacterium clone G250WV301BK55G 16S ribosomal RNA gene, partial sequence"
A00470:566:HF2L2DRX3:1:2275:7374:2174_AAGAACTCAG,KF334962.1,100.0,"Uncultured bacterium clone G250WV301BLCOA 16S ribosomal RNA gene, partial sequence"
A00470:566:HF2L2DRX3:1:2275:7374:2174_AAGAACTCAG,KF334537.1,100.0,"Uncultured bacterium clone G250WV301AEROC 16S ribosomal RNA gene, partial sequence"
A00470:566:HF2L2DRX3:1:2276:16432:23469_GGACCCAAAA,KF097644.1,100.0,"Uncultured bacterium clone nck243e01c1 16S ribosomal RNA gene, partial sequence"
A00470:566:HF2L2DRX3:1:2276:16432:23469_GGACCCAAAA,KF722219.1,100.0,"Uncultured Enterobacteriaceae bacterium clone DVBSW_J256 16S ribosomal RNA gene, partial sequence"
A00470:566:HF2L2DRX3:1:2276:16432:23469_GGACCCAAAA,CP006568.1,100.0,"Candidatus Sodalis pierantonius str. SOPE chromosome, complete genome"
A00470:566:HF2L2DRX3:1:2276:16432:23469_GGACCCAAAA,MW767020.1,100.0,"Shigella flexneri strain S40 16S ribosomal RNA gene, partial sequence"
A00470:566:HF2L2DRX3:1:2276:16432:23469_GGACCCAAAA,KC001264.1,100.0,"Unidentified marine bacterioplankton clone P3-3B_102 16S ribosomal RNA gene, partial sequence"
A00470:566:HF2L2DRX3:1:2276:21115:11913_CTCCCACGCA,CP089129.1,95.0,Saccharomyces cerevisiae strain S288C-SK1-cross isolate tetrad 8 spore a chromosome XIII
A00470:566:HF2L2DRX3:1:2276:21115:11913_CTCCCACGCA,CP089128.1,95.0,Saccharomyces cerevisiae strain S288C-SK1-cross isolate tetrad 8 spore a chromosome XII
A00470:566:HF2L2DRX3:1:2276:21115:11913_CTCCCACGCA,CP089127.1,95.0,Saccharomyces cerevisiae strain S288C-SK1-cross isolate tetrad 8 spore a chromosome XI
A00470:566:HF2L2DRX3:1:2276:21115:11913_CTCCCACGCA,CP089126.1,95.0,Saccharomyces cerevisiae strain S288C-SK1-cross isolate tetrad 8 spore a chromosome X
A00470:566:HF2L2DRX3:1:2276:21115:11913_CTCCCACGCA,CP089124.1,95.0,Saccharomyces cerevisiae strain S288C-SK1-cross isolate tetrad 8 spore a chromosome VIII
A00470:566:HF2L2DRX3:1:2242:5222:27258_GACGGCAAAG,MN894805.1,100.0,"Homo sapiens haplogroup H3v+16093 mitochondrion, complete genome"
A00470:566:HF2L2DRX3:1:2242:5222:27258_GACGGCAAAG,MN894804.1,100.0,"Homo sapiens haplogroup J1b2 mitochondrion, complete genome"
A00470:566:HF2L2DRX3:1:2242:5222:27258_GACGGCAAAG,MN894803.1,100.0,"Homo sapiens haplogroup V9 mitochondrion, complete genome"
A00470:566:HF2L2DRX3:1:2242:5222:27258_GACGGCAAAG,MN894801.1,100.0,"Homo sapiens haplogroup A2h mitochondrion, complete genome"
A00470:566:HF2L2DRX3:1:2242:5222:27258_GACGGCAAAG,MN894800.1,100.0,"Homo sapiens haplogroup H1ba mitochondrion, complete genome"
A00470:566:HF2L2DRX3:1:2245:17752:31610_TTTAGAATAC,OL825021.1,98.718,"Kluyveromyces marxianus strain BR19 large subunit ribosomal RNA gene, partial sequence"
A00470:566:HF2L2DRX3:1:2245:17752:31610_TTTAGAATAC,OL825017.1,98.718,"Kluyveromyces marxianus strain BR12 large subunit ribosomal RNA gene, partial sequence"
A00470:566:HF2L2DRX3:1:2245:17752:31610_TTTAGAATAC,LC664137.1,98.718,"Saccharomyces cerevisiae FGY18 gene for 26S rRNA, partial sequence"
A00470:566:HF2L2DRX3:1:2245:17752:31610_TTTAGAATAC,LC664136.1,98.718,"Saccharomyces cerevisiae FGY13 gene for 26S rRNA, partial sequence"
A00470:566:HF2L2DRX3:1:2245:17752:31610_TTTAGAATAC,LC664135.1,98.718,"Saccharomyces cerevisiae FGY10 gene for 26S rRNA, partial sequence"
A00470:566:HF2L2DRX3:1:2245:27299:21527_AGGCCCCATG,AP025275.1,100.0,"Pseudomonas sp. MRCP1333 MRCP1333 DNA, complete genome"
A00470:566:HF2L2DRX3:1:2245:27299:21527_AGGCCCCATG,CP065340.1,100.0,Pseudomonas lalucatii strain R1b52 chromosome
A00470:566:HF2L2DRX3:1:2245:27299:21527_AGGCCCCATG,CP060288.1,100.0,"Pseudomonas mendocina strain CPS5 chromosome, complete genome"
A00470:566:HF2L2DRX3:1:2245:27299:21527_AGGCCCCATG,LR215729.2,100.0,"Pseudomonas marincola strain YSy11 genome assembly, chromosome: PMYSY11"
A00470:566:HF2L2DRX3:1:2245:27299:21527_AGGCCCCATG,CP058247.1,100.0,Pseudomonas sp. LPB0260 strain LPB260 chromosome
A00470:566:HF2L2DRX3:2:1101:23683:33395_CTAGAGCGAG,CP089445.1,98.276,"Escherichia coli strain 5-1 chromosome, complete genome"
A00470:566:HF2L2DRX3:2:1101:23683:33395_CTAGAGCGAG,OU701452.1,98.276,"Escherichia coli isolate CNR65D6 genome assembly, chromosome: 1"
A00470:566:HF2L2DRX3:2:1101:23683:33395_CTAGAGCGAG,OU701449.1,98.276,"Escherichia coli isolate CNR85I8 genome assembly, chromosome: 1"
A00470:566:HF2L2DRX3:2:1101:23683:33395_CTAGAGCGAG,7LVK_I,98.276,"Chain I, 23S rRNA"
A00470:566:HF2L2DRX3:2:1101:23683:33395_CTAGAGCGAG,CP089272.1,98.276,"Escherichia coli O157:H7 strain M1300706001A chromosome, complete genome"
A00470:566:HF2L2DRX3:2:1101:6858:24893_TCTGGACAAC,OL762361.1,100.0,"Weissella confusa strain SM1 16S ribosomal RNA gene, partial sequence"
A00470:566:HF2L2DRX3:2:1101:6858:24893_TCTGGACAAC,OL762334.1,100.0,"Weissella cibaria strain KH1006 16S ribosomal RNA gene, partial sequence"
A00470:566:HF2L2DRX3:2:1101:6858:24893_TCTGGACAAC,KF245542.1,100.0,"Weissella confusa strain F2S2 16S ribosomal RNA gene, partial sequence"
A00470:566:HF2L2DRX3:2:1101:6858:24893_TCTGGACAAC,KF245541.1,100.0,"Weissella confusa strain F2S1 16S ribosomal RNA gene, partial sequence"
A00470:566:HF2L2DRX3:2:1101:6858:24893_TCTGGACAAC,KJ841932.1,100.0,"Weissella koreensis strain FKI21 16S ribosomal RNA gene, partial sequence"
A00470:566:HF2L2DRX3:2:1102:18457:13103_GGGCACTCAC,JN700008.1,100.0,"Uncultured beta proteobacterium clone G9-01QJN 16S ribosomal RNA gene, partial sequence"
A00470:566:HF2L2DRX3:2:1102:18457:13103_GGGCACTCAC,OL757788.1,98.75,"Variovorax guangxiensis strain LG-Z3 16S ribosomal RNA gene, partial sequence"
A00470:566:HF2L2DRX3:2:1102:18457:13103_GGGCACTCAC,OL636331.1,98.75,"Acidovorax temperans strain S_WO.SB14.074 16S ribosomal RNA gene, partial sequence"
A00470:566:HF2L2DRX3:2:1102:18457:13103_GGGCACTCAC,OL636325.1,98.75,"Acidovorax facilis strain S_WO.AB16.053 16S ribosomal RNA gene, partial sequence"
A00470:566:HF2L2DRX3:2:1102:18457:13103_GGGCACTCAC,OL636267.1,98.75,"Acidovorax facilis strain S_WE.S10.072 16S ribosomal RNA gene, partial sequence"
A00470:566:HF2L2DRX3:2:1103:19054:13228_GAAGGAACAC,CP089445.1,100.0,"Escherichia coli strain 5-1 chromosome, complete genome"
A00470:566:HF2L2DRX3:2:1103:19054:13228_GAAGGAACAC,CP089316.1,100.0,"Citrobacter portucalensis strain K218 chromosome, complete genome"
A00470:566:HF2L2DRX3:2:1103:19054:13228_GAAGGAACAC,AP025334.1,100.0,"Phytobacter diazotrophicus TA9734 DNA, complete genome"
A00470:566:HF2L2DRX3:2:1103:19054:13228_GAAGGAACAC,OL826824.1,100.0,"Escherichia coli strain Samah 2021 16S ribosomal RNA gene, partial sequence"
A00470:566:HF2L2DRX3:2:1103:19054:13228_GAAGGAACAC,OL825738.1,100.0,"Escherichia coli strain Wafaa2021 16S ribosomal RNA gene, partial sequence"
A00470:566:HF2L2DRX3:2:1105:10936:15107_CCCACCGGCG,7MQ8_L0,100.0,"Chain L0, 5'ETS rRNA"
A00470:566:HF2L2DRX3:2:1105:10936:15107_CCCACCGGCG,KC876030.1,100.0,Homo sapiens clone LA13_165F6 sequence
A00470:566:HF2L2DRX3:2:1105:10936:15107_CCCACCGGCG,KC876029.1,100.0,Homo sapiens clone LA14_101B3 sequence
A00470:566:HF2L2DRX3:2:1105:10936:15107_CCCACCGGCG,KC876027.1,100.0,Homo sapiens clone N29M24 sequence
A00470:566:HF2L2DRX3:2:1105:10936:15107_CCCACCGGCG,CP068256.2,100.0,Homo sapiens isolate CHM13 chromosome 22
A00470:566:HF2L2DRX3:2:1105:1985:7310_CCGCTTTCGG,CP089445.1,100.0,"Escherichia coli strain 5-1 chromosome, complete genome"
A00470:566:HF2L2DRX3:2:1105:1985:7310_CCGCTTTCGG,CP089313.1,100.0,"Salmonella enterica subsp. enterica serovar Indiana strain YZ21MCS4 chromosome, complete genome"
A00470:566:HF2L2DRX3:2:1105:1985:7310_CCGCTTTCGG,OL823013.1,100.0,"Escherichia coli strain SYAU21-D1 16S ribosomal RNA gene, partial sequence"
A00470:566:HF2L2DRX3:2:1105:1985:7310_CCGCTTTCGG,OU701452.1,100.0,"Escherichia coli isolate CNR65D6 genome assembly, chromosome: 1"
A00470:566:HF2L2DRX3:2:1105:1985:7310_CCGCTTTCGG,OU701449.1,100.0,"Escherichia coli isolate CNR85I8 genome assembly, chromosome: 1"
A00470:566:HF2L2DRX3:2:1105:23276:33442_CAACCTAGGA,LC661719.1,100.0,"Burkholderia sp. JF15 gene for 16S rRNA, partial sequence"
A00470:566:HF2L2DRX3:2:1105:23276:33442_CAACCTAGGA,LC661712.1,100.0,"Burkholderia sp. JA6 gene for 16S rRNA, partial sequence"
A00470:566:HF2L2DRX3:2:1105:23276:33442_CAACCTAGGA,OK236184.1,100.0,"Burkholderia sp. strain 495 16S ribosomal RNA gene, partial sequence"
A00470:566:HF2L2DRX3:2:1105:23276:33442_CAACCTAGGA,KJ646882.1,100.0,"Burkholderia sp. 16(2014) 16S ribosomal RNA gene, partial sequence"
A00470:566:HF2L2DRX3:2:1105:23276:33442_CAACCTAGGA,KF108220.1,100.0,"Uncultured bacterium clone ncm68f02c1 16S ribosomal RNA gene, partial sequence"
A00470:566:HF2L2DRX3:1:2247:14443:24001_TTCACTACTA,KF650425.1,90.698,"Uncultured bacterium clone BYL38-92 16S ribosomal RNA gene, partial sequence"
A00470:566:HF2L2DRX3:1:2247:14443:24001_TTCACTACTA,KF721874.1,89.655,"Uncultured bacterium clone DVBSW_D193 16S ribosomal RNA gene, partial sequence"
A00470:566:HF2L2DRX3:1:2247:14443:24001_TTCACTACTA,KF650424.1,89.655,"Uncultured bacterium clone BYL38-84 16S ribosomal RNA gene, partial sequence"
A00470:566:HF2L2DRX3:1:2247:14443:24001_TTCACTACTA,KF650421.1,89.655,"Uncultured bacterium clone BYL38-81 16S ribosomal RNA gene, partial sequence"
A00470:566:HF2L2DRX3:1:2247:14443:24001_TTCACTACTA,KF650420.1,89.655,"Uncultured bacterium clone BYL38-60 16S ribosomal RNA gene, partial sequence"
A00470:566:HF2L2DRX3:1:2248:22336:9236_GGTTGACCCC,CP089385.1,98.113,"Klebsiella variicola subsp. variicola strain KPN692 chromosome, complete genome"
A00470:566:HF2L2DRX3:1:2248:22336:9236_GGTTGACCCC,CP089383.1,98.113,"Klebsiella pneumoniae strain KPN342 chromosome, complete genome"
A00470:566:HF2L2DRX3:1:2248:22336:9236_GGTTGACCCC,CP089316.1,98.113,"Citrobacter portucalensis strain K218 chromosome, complete genome"
A00470:566:HF2L2DRX3:1:2248:22336:9236_GGTTGACCCC,AP025334.1,98.113,"Phytobacter diazotrophicus TA9734 DNA, complete genome"
A00470:566:HF2L2DRX3:1:2248:22336:9236_GGTTGACCCC,AP024579.1,98.113,"Klebsiella pneumoniae KpWEA4-2 DNA, complete genome"
A00470:566:HF2L2DRX3:1:2248:28447:1407_CAAAGTCCAC,GU926741.1,98.462,"Uncultured bacterium clone F5K2Q4C04JZE3E 23S ribosomal RNA gene, partial sequence"
A00470:566:HF2L2DRX3:1:2248:28447:1407_CAAAGTCCAC,GU926002.1,98.462,"Uncultured bacterium clone F5K2Q4C04I3MOC 23S ribosomal RNA gene, partial sequence"
A00470:566:HF2L2DRX3:1:2248:28447:1407_CAAAGTCCAC,GU925890.1,98.462,"Uncultured bacterium clone F5K2Q4C04I8WJC 23S ribosomal RNA gene, partial sequence"
A00470:566:HF2L2DRX3:1:2248:28447:1407_CAAAGTCCAC,GU923834.1,98.462,"Uncultured bacterium clone F5K2Q4C04IU3HQ 23S ribosomal RNA gene, partial sequence"
A00470:566:HF2L2DRX3:1:2248:28447:1407_CAAAGTCCAC,GU925624.1,95.385,"Uncultured bacterium clone F5K2Q4C04IJ7OS 23S ribosomal RNA gene, partial sequence"
A00470:566:HF2L2DRX3:1:2249:28212:31219_GGGCATATCT,AC211476.5,100.0,"Homo sapiens BAC clone CH17-264B6 from chromosome 7, complete sequence"
A00470:566:HF2L2DRX3:1:2249:28212:31219_GGGCATATCT,AC211491.5,100.0,"Homo sapiens BAC clone CH17-220H16 from chromosome 7, complete sequence"
A00470:566:HF2L2DRX3:1:2249:28212:31219_GGGCATATCT,AP023730.1,100.0,"Homo sapiens DNA, sequence_id: unplaced_0245"
A00470:566:HF2L2DRX3:1:2249:28212:31219_GGGCATATCT,AC280218.1,100.0,"Homo sapiens chromosome unknown clone VMRC62-26K15, complete sequence"
A00470:566:HF2L2DRX3:1:2249:28212:31219_GGGCATATCT,AC241978.2,100.0,"Homo sapiens FOSMID clone WI2-2363B13 from chromosome 7, complete sequence"
A00470:566:HF2L2DRX3:2:1107:17879:6558_CATATCCAGG,KJ781398.1,98.649,"Serratia marcescens strain CF-S28 16S ribosomal RNA gene, partial sequence"
A00470:566:HF2L2DRX3:2:1107:17879:6558_CATATCCAGG,KC805847.1,98.649,"Uncultured bacterium clone FS2_SO_038 16S ribosomal RNA gene, partial sequence"
A00470:566:HF2L2DRX3:2:1107:17879:6558_CATATCCAGG,KC805740.1,98.649,"Uncultured bacterium clone FS2_SC_305 16S ribosomal RNA gene, partial sequence"
A00470:566:HF2L2DRX3:2:1107:17879:6558_CATATCCAGG,KC873085.1,98.649,"Uncultured bacterium clone S41_085 16S ribosomal RNA gene, partial sequence"
A00470:566:HF2L2DRX3:2:1107:17879:6558_CATATCCAGG,KC872153.1,98.649,"Uncultured bacterium clone S12_036 16S ribosomal RNA gene, partial sequence"
A00470:566:HF2L2DRX3:2:1108:2700:10019_TTCGGACATC,HG938371.2,100.0,"Burkholderia cenocepacia H111 chromosome 2, complete genome"
A00470:566:HF2L2DRX3:2:1108:2700:10019_TTCGGACATC,CP086306.1,100.0,"Burkholderia ambifaria strain B21-004 chromosome 3, complete sequence"
A00470:566:HF2L2DRX3:2:1108:2700:10019_TTCGGACATC,CP086305.1,100.0,"Burkholderia ambifaria strain B21-004 chromosome 2, complete sequence"
A00470:566:HF2L2DRX3:2:1108:2700:10019_TTCGGACATC,CP086304.1,100.0,"Burkholderia ambifaria strain B21-004 chromosome 1, complete sequence"
A00470:566:HF2L2DRX3:2:1108:2700:10019_TTCGGACATC,CP085997.1,100.0,"Burkholderia vietnamiensis strain FDAARGOS_1590 chromosome 2, complete sequence"
A00470:566:HF2L2DRX3:2:1109:2193:31000_TTCCCATAGA,OL742681.1,100.0,"Loktanella sp. strain HNIBRBA683 16S ribosomal RNA gene, partial sequence"
A00470:566:HF2L2DRX3:2:1109:2193:31000_TTCCCATAGA,OL677198.1,100.0,"Sulfitobacter sp. strain KMM 10013 16S ribosomal RNA gene, partial sequence"
A00470:566:HF2L2DRX3:2:1109:2193:31000_TTCCCATAGA,OL677193.1,100.0,"Sulfitobacter sp. strain KMM 9951 16S ribosomal RNA gene, partial sequence"
A00470:566:HF2L2DRX3:2:1109:2193:31000_TTCCCATAGA,OL677186.1,100.0,"Sulfitobacter sp. strain KMM 343 16S ribosomal RNA gene, partial sequence"
A00470:566:HF2L2DRX3:2:1109:2193:31000_TTCCCATAGA,OL672363.1,100.0,"Sulfitobacter sp. strain MA EN P3.9 16S ribosomal RNA gene, partial sequence"
A00470:566:HF2L2DRX3:1:2253:23773:15953_CAAACAACCC,OL762361.1,100.0,"Weissella confusa strain SM1 16S ribosomal RNA gene, partial sequence"
A00470:566:HF2L2DRX3:1:2253:23773:15953_CAAACAACCC,OL762334.1,100.0,"Weissella cibaria strain KH1006 16S ribosomal RNA gene, partial sequence"
A00470:566:HF2L2DRX3:1:2253:23773:15953_CAAACAACCC,MW057762.1,100.0,"Weissella cibaria strain W.ciberia 16S ribosomal RNA gene, partial sequence"
A00470:566:HF2L2DRX3:1:2253:23773:15953_CAAACAACCC,KJ590387.1,100.0,"Uncultured Eubacteriaceae bacterium clone GF3-110728-5 16S ribosomal RNA (rrs) gene, partial sequence"
A00470:566:HF2L2DRX3:1:2253:23773:15953_CAAACAACCC,KF245542.1,100.0,"Weissella confusa strain F2S2 16S ribosomal RNA gene, partial sequence"
A00470:566:HF2L2DRX3:1:2254:17372:15389_GGCCAAATAT,CP089303.1,100.0,"Limosilactobacillus reuteri strain VHProbi M07 chromosome, complete genome"
A00470:566:HF2L2DRX3:1:2254:17372:15389_GGCCAAATAT,CP088931.1,100.0,"Limosilactobacillus reuteri strain VHProbi E18 chromosome, complete genome"
A00470:566:HF2L2DRX3:1:2254:17372:15389_GGCCAAATAT,CP065852.1,100.0,Limosilactobacillus reuteri isolate 3632 plasmid unnamed3
A00470:566:HF2L2DRX3:1:2254:17372:15389_GGCCAAATAT,CP065849.1,100.0,Limosilactobacillus reuteri isolate 3632 chromosome
A00470:566:HF2L2DRX3:1:2254:17372:15389_GGCCAAATAT,CP065330.1,100.0,Limosilactobacillus reuteri isolate 3630 chromosome
A00470:566:HF2L2DRX3:2:1111:27091:8484_AAGCCCACCA,CP088292.1,98.701,"Phyllobacterium sp. T1018 chromosome, complete genome"
A00470:566:HF2L2DRX3:2:1111:27091:8484_AAGCCCACCA,CP088274.1,98.701,"Phyllobacterium sp. T1293 plasmid pT1293c, complete sequence"
A00470:566:HF2L2DRX3:2:1111:27091:8484_AAGCCCACCA,CP088273.1,98.701,"Phyllobacterium sp. T1293 chromosome, complete genome"
A00470:566:HF2L2DRX3:2:1111:27091:8484_AAGCCCACCA,CP088104.1,98.701,"Rhizobium ruizarguesonis strain TA1 chromosome, complete genome"
A00470:566:HF2L2DRX3:2:1111:27091:8484_AAGCCCACCA,CP088095.1,98.701,"Rhizobium leguminosarum bv. viciae strain SU303 chromosome, complete genome"
A00470:566:HF2L2DRX3:2:1112:1597:7733_GCCATTGCTT,CP089445.1,96.296,"Escherichia coli strain 5-1 chromosome, complete genome"
A00470:566:HF2L2DRX3:2:1112:1597:7733_GCCATTGCTT,CP089313.1,96.296,"Salmonella enterica subsp. enterica serovar Indiana strain YZ21MCS4 chromosome, complete genome"
A00470:566:HF2L2DRX3:2:1112:1597:7733_GCCATTGCTT,AP025334.1,96.296,"Phytobacter diazotrophicus TA9734 DNA, complete genome"
A00470:566:HF2L2DRX3:2:1112:1597:7733_GCCATTGCTT,OU701452.1,96.296,"Escherichia coli isolate CNR65D6 genome assembly, chromosome: 1"
A00470:566:HF2L2DRX3:2:1112:1597:7733_GCCATTGCTT,OU701449.1,96.296,"Escherichia coli isolate CNR85I8 genome assembly, chromosome: 1"
A00470:566:HF2L2DRX3:1:2256:3703:34741_CGGCCCACTT,CP089128.1,100.0,Saccharomyces cerevisiae strain S288C-SK1-cross isolate tetrad 8 spore a chromosome XII
A00470:566:HF2L2DRX3:1:2256:3703:34741_CGGCCCACTT,CP089111.1,100.0,Saccharomyces cerevisiae strain S288C-SK1-cross isolate tetrad 12 spore a chromosome XII
A00470:566:HF2L2DRX3:1:2256:3703:34741_CGGCCCACTT,CP088321.1,100.0,Saccharomyces cerevisiae strain F chromosome XII
A00470:566:HF2L2DRX3:1:2256:3703:34741_CGGCCCACTT,CP088312.1,100.0,Saccharomyces cerevisiae strain A chromosome XII
A00470:566:HF2L2DRX3:1:2256:3703:34741_CGGCCCACTT,7OSA_25S,100.0,"Chain 25S, 25S rRNA"
A00470:566:HF2L2DRX3:1:2256:5150:1579_CCCACATATT,MZ420323.1,98.718,"Spumella communis strain Meonmulgak032418A6 large subunit ribosomal RNA gene, partial sequence"
A00470:566:HF2L2DRX3:1:2256:5150:1579_CCCACATATT,MZ420322.1,98.718,"Spumella longicolla strain Yangrimje041319B6 large subunit ribosomal RNA gene, partial sequence"
A00470:566:HF2L2DRX3:1:2256:5150:1579_CCCACATATT,MZ420321.1,98.718,"Spumella bureschii strain Yangjije021018A19 large subunit ribosomal RNA gene, partial sequence"
A00470:566:HF2L2DRX3:1:2256:5150:1579_CCCACATATT,MZ420320.1,98.718,"Spumella bureschii strain Wolbong021018C8 large subunit ribosomal RNA gene, partial sequence"
A00470:566:HF2L2DRX3:1:2256:5150:1579_CCCACATATT,MZ420319.1,98.718,"Spumella bureschii strain Saenggeunje120118A5 large subunit ribosomal RNA gene, partial sequence"
A00470:566:HF2L2DRX3:1:2257:1759:8641_ACAGGACAGG,CP005927.1,100.0,"Serratia sp. FS14, complete genome"
A00470:566:HF2L2DRX3:1:2257:1759:8641_ACAGGACAGG,CP007439.1,100.0,Serratia plymuthica strain V4 genome
A00470:566:HF2L2DRX3:1:2257:1759:8641_ACAGGACAGG,AP024916.1,100.0,"Serratia marcescens SL267 DNA, complete genome"
A00470:566:HF2L2DRX3:1:2257:1759:8641_ACAGGACAGG,CP083690.1,100.0,"Serratia sp. HRI chromosome, complete genome"
A00470:566:HF2L2DRX3:1:2257:1759:8641_ACAGGACAGG,CP074137.1,100.0,"Serratia sp. JSRIV006 chromosome, complete genome"
A00470:566:HF2L2DRX3:1:2257:25681:20697_ATAGCCCCCC,CP089128.1,100.0,Saccharomyces cerevisiae strain S288C-SK1-cross isolate tetrad 8 spore a chromosome XII
A00470:566:HF2L2DRX3:1:2257:25681:20697_ATAGCCCCCC,CP089111.1,100.0,Saccharomyces cerevisiae strain S288C-SK1-cross isolate tetrad 12 spore a chromosome XII
A00470:566:HF2L2DRX3:1:2257:25681:20697_ATAGCCCCCC,CP088321.1,100.0,Saccharomyces cerevisiae strain F chromosome XII
A00470:566:HF2L2DRX3:1:2257:25681:20697_ATAGCCCCCC,CP088312.1,100.0,Saccharomyces cerevisiae strain A chromosome XII
A00470:566:HF2L2DRX3:1:2257:25681:20697_ATAGCCCCCC,7OSA_25S,100.0,"Chain 25S, 25S rRNA"
A00470:566:HF2L2DRX3:1:2258:12707:3458_CTCCCGCATG,CP089128.1,100.0,Saccharomyces cerevisiae strain S288C-SK1-cross isolate tetrad 8 spore a chromosome XII
A00470:566:HF2L2DRX3:1:2258:12707:3458_CTCCCGCATG,CP089111.1,100.0,Saccharomyces cerevisiae strain S288C-SK1-cross isolate tetrad 12 spore a chromosome XII
A00470:566:HF2L2DRX3:1:2258:12707:3458_CTCCCGCATG,CP088321.1,100.0,Saccharomyces cerevisiae strain F chromosome XII
A00470:566:HF2L2DRX3:1:2258:12707:3458_CTCCCGCATG,CP088312.1,100.0,Saccharomyces cerevisiae strain A chromosome XII
A00470:566:HF2L2DRX3:1:2258:12707:3458_CTCCCGCATG,7OSA_25S,100.0,"Chain 25S, 25S rRNA"
A00470:566:HF2L2DRX3:1:2258:30897:29011_GGGCACCCCC,CP089445.1,100.0,"Escherichia coli strain 5-1 chromosome, complete genome"
A00470:566:HF2L2DRX3:1:2258:30897:29011_GGGCACCCCC,CP089316.1,100.0,"Citrobacter portucalensis strain K218 chromosome, complete genome"
A00470:566:HF2L2DRX3:1:2258:30897:29011_GGGCACCCCC,OL826824.1,100.0,"Escherichia coli strain Samah 2021 16S ribosomal RNA gene, partial sequence"
A00470:566:HF2L2DRX3:1:2258:30897:29011_GGGCACCCCC,OL825738.1,100.0,"Escherichia coli strain Wafaa2021 16S ribosomal RNA gene, partial sequence"
A00470:566:HF2L2DRX3:1:2258:30897:29011_GGGCACCCCC,OL824845.1,100.0,"Enterobacter hormaechei strain SRB6 16S ribosomal RNA gene, partial sequence"
A00470:566:HF2L2DRX3:1:2258:7184:25895_AAATAACTTA,KC664255.1,100.0,"Uncultured eukaryote clone 18S-G6-2-11A 18S ribosomal RNA gene, partial sequence"
A00470:566:HF2L2DRX3:1:2258:7184:25895_AAATAACTTA,KC664236.1,100.0,"Uncultured eukaryote clone 18S-T0-1-C10 18S ribosomal RNA gene, partial sequence"
A00470:566:HF2L2DRX3:1:2258:7184:25895_AAATAACTTA,MN860289.1,100.0,"Rhogostoma bowseri strain B14 small subunit ribosomal RNA gene, partial sequence"
A00470:566:HF2L2DRX3:1:2258:7184:25895_AAATAACTTA,MN860288.1,100.0,"Rhogostoma bowseri strain 3A small subunit ribosomal RNA gene, partial sequence"
A00470:566:HF2L2DRX3:1:2258:7184:25895_AAATAACTTA,MN860282.1,100.0,"Rhogostoma radagasteri strain TG4 II small subunit ribosomal RNA gene, partial sequence"
A00470:566:HF2L2DRX3:2:1115:12255:11224_TATTCACAAC,CP006032.1,100.0,"Propionibacterium acnes hdn-1, complete genome"
A00470:566:HF2L2DRX3:2:1115:12255:11224_TATTCACAAC,CP084017.1,100.0,"Cutibacterium acnes subsp. acnes strain NBRC 113869 chromosome, complete genome"
A00470:566:HF2L2DRX3:2:1115:12255:11224_TATTCACAAC,CP003293.1,100.0,"Propionibacterium acnes HL096PA1, complete genome"
A00470:566:HF2L2DRX3:2:1115:12255:11224_TATTCACAAC,NR_076216.1,100.0,"Propionibacterium acnes strain KPA171202 23S ribosomal RNA gene, complete sequence"
A00470:566:HF2L2DRX3:2:1115:12255:11224_TATTCACAAC,CP003877.1,100.0,"Propionibacterium acnes C1, complete genome"
A00470:566:HF2L2DRX3:2:1115:30544:30467_TTCCGGAGTA,CP088032.1,100.0,"Escherichia coli strain 437024 chromosome, complete genome"
A00470:566:HF2L2DRX3:2:1115:30544:30467_TTCCGGAGTA,CP088042.1,100.0,"Escherichia coli strain 432300 chromosome, complete genome"
A00470:566:HF2L2DRX3:2:1115:30544:30467_TTCCGGAGTA,CP088071.1,100.0,"Escherichia coli strain 427603 chromosome, complete genome"
A00470:566:HF2L2DRX3:2:1115:30544:30467_TTCCGGAGTA,LR778145.1,100.0,"Escherichia coli isolate SC423 genome assembly, chromosome: omosome1"
A00470:566:HF2L2DRX3:2:1115:30544:30467_TTCCGGAGTA,OU701452.1,100.0,"Escherichia coli isolate CNR65D6 genome assembly, chromosome: 1"
A00470:566:HF2L2DRX3:2:1116:20654:25019_GACTCTTGAC,CP065406.1,100.0,"Diaphorobacter sp. JS3051 chromosome, complete genome"
A00470:566:HF2L2DRX3:2:1116:20654:25019_GACTCTTGAC,CP060790.1,100.0,"Paenacidovorax monticola strain KACC 19171 chromosome, complete genome"
A00470:566:HF2L2DRX3:2:1116:20654:25019_GACTCTTGAC,GU925542.1,100.0,"Uncultured bacterium clone F5K2Q4C04JE8FP 23S ribosomal RNA gene, partial sequence"
A00470:566:HF2L2DRX3:2:1116:20654:25019_GACTCTTGAC,GU925477.1,100.0,"Uncultured bacterium clone F5K2Q4C04INGK5 23S ribosomal RNA gene, partial sequence"
A00470:566:HF2L2DRX3:2:1116:20654:25019_GACTCTTGAC,CP000555.1,100.0,"Methylibium petroleiphilum PM1, complete genome"
A00470:566:HF2L2DRX3:2:1117:14796:16250_AAACTTCAAG,CP080582.1,100.0,"Weissella confusa strain LM1 chromosome, complete genome"
A00470:566:HF2L2DRX3:2:1117:14796:16250_AAACTTCAAG,CP059699.1,100.0,"Weissella cibaria strain CBA3636 chromosome, complete genome"
A00470:566:HF2L2DRX3:2:1117:14796:16250_AAACTTCAAG,CP086020.1,97.297,"Weissella hellenica strain MBEL1842 chromosome, complete genome"
A00470:566:HF2L2DRX3:2:1117:14796:16250_AAACTTCAAG,CP061835.1,95.946,"Weissella viridescens strain NJ100 chromosome, complete genome"
A00470:566:HF2L2DRX3:2:1117:14796:16250_AAACTTCAAG,CP060724.1,95.946,"Weissella diestrammenae strain KACC 16890 chromosome, complete genome"
