qseqid,sseqid,pident,sseq_name
A00470:566:HF2L2DRX3:1:1105:30743:6230_GGGCACCCCG,NG_042006.1,97.403,"Dinoroseobacter shibae strain DFL 12 23S ribosomal RNA gene, complete sequence"
A00470:566:HF2L2DRX3:1:1105:30743:6230_GGGCACCCCG,CP000830.1,97.403,"Dinoroseobacter shibae DFL 12, complete genome"
A00470:566:HF2L2DRX3:1:1105:30743:6230_GGGCACCCCG,CP080623.1,96.104,"Roseovarius sp. SCSIO 43702 chromosome, complete genome"
A00470:566:HF2L2DRX3:1:1105:30743:6230_GGGCACCCCG,CP060010.1,96.104,"Cognatishimia activa strain ECT2AJA-044 chromosome, complete genome"
A00470:566:HF2L2DRX3:1:1105:30743:6230_GGGCACCCCG,CP051233.1,96.104,MAG: Thalassovita sp. isolate m4 chromosome
A00470:566:HF2L2DRX3:1:1106:27263:15421_CAGGATACCC,KF650425.1,97.436,"Uncultured bacterium clone BYL38-92 16S ribosomal RNA gene, partial sequence"
A00470:566:HF2L2DRX3:1:1106:27263:15421_CAGGATACCC,KF650424.1,97.436,"Uncultured bacterium clone BYL38-84 16S ribosomal RNA gene, partial sequence"
A00470:566:HF2L2DRX3:1:1106:27263:15421_CAGGATACCC,KF650420.1,97.436,"Uncultured bacterium clone BYL38-60 16S ribosomal RNA gene, partial sequence"
A00470:566:HF2L2DRX3:1:1106:27263:15421_CAGGATACCC,KF650417.1,97.436,"Uncultured bacterium clone BYL38-57 16S ribosomal RNA gene, partial sequence"
A00470:566:HF2L2DRX3:1:1106:27263:15421_CAGGATACCC,KF650416.1,97.436,"Uncultured bacterium clone BYL38-53 16S ribosomal RNA gene, partial sequence"
A00470:566:HF2L2DRX3:1:1137:12310:3239_GACGGGTCCA,CP080582.1,100.0,"Weissella confusa strain LM1 chromosome, complete genome"
A00470:566:HF2L2DRX3:1:1137:12310:3239_GACGGGTCCA,CP059699.1,100.0,"Weissella cibaria strain CBA3636 chromosome, complete genome"
A00470:566:HF2L2DRX3:1:1137:12310:3239_GACGGGTCCA,AY342345.1,100.0,"Weissella kimchii 16S ribosomal RNA gene, partial sequence; tRNA-Ile and tRNA-Ala genes, complete sequence; and 23S ribosomal RNA gene, partial sequence"
A00470:566:HF2L2DRX3:1:1137:12310:3239_GACGGGTCCA,AY342324.1,100.0,"Weissella confusa 16S ribosomal RNA gene, partial sequence; tRNA-Ala gene, complete sequence; and 23S ribosomal RNA gene, partial sequence"
A00470:566:HF2L2DRX3:1:1137:12310:3239_GACGGGTCCA,AY342323.1,100.0,"Weissella confusa 16S ribosomal RNA and 23S ribosomal RNA genes, partial sequence"
A00470:566:HF2L2DRX3:1:1137:24180:32440_TCAATGGTGA,CP089448.1,98.077,"Klebsiella michiganensis strain 8-1 chromosome, complete genome"
A00470:566:HF2L2DRX3:1:1137:24180:32440_TCAATGGTGA,CP089445.1,98.077,"Escherichia coli strain 5-1 chromosome, complete genome"
A00470:566:HF2L2DRX3:1:1137:24180:32440_TCAATGGTGA,CP089385.1,98.077,"Klebsiella variicola subsp. variicola strain KPN692 chromosome, complete genome"
A00470:566:HF2L2DRX3:1:1137:24180:32440_TCAATGGTGA,CP089315.1,98.077,"Klebsiella michiganensis strain K92 chromosome, complete genome"
A00470:566:HF2L2DRX3:1:1137:24180:32440_TCAATGGTGA,CP089313.1,98.077,"Salmonella enterica subsp. enterica serovar Indiana strain YZ21MCS4 chromosome, complete genome"
A00470:566:HF2L2DRX3:1:1137:7129:7795_ACAACACCAA,CP089317.1,100.0,"Proteus mirabilis strain PM1162 chromosome, complete genome"
A00470:566:HF2L2DRX3:1:1137:7129:7795_ACAACACCAA,CP087392.1,100.0,"Pectobacterium parvum strain FN20211 chromosome, complete genome"
A00470:566:HF2L2DRX3:1:1137:7129:7795_ACAACACCAA,NR_121944.1,100.0,"Serratia liquefaciens strain ATCC 27592 23S ribosomal RNA gene, complete sequence"
A00470:566:HF2L2DRX3:1:1137:7129:7795_ACAACACCAA,CP007744.1,100.0,"Pectobacterium atrosepticum strain JG10-08, complete genome"
A00470:566:HF2L2DRX3:1:1137:7129:7795_ACAACACCAA,CP005927.1,100.0,"Serratia sp. FS14, complete genome"
A00470:566:HF2L2DRX3:1:1137:8811:13589_TATTCAGTAT,CP089128.1,100.0,Saccharomyces cerevisiae strain S288C-SK1-cross isolate tetrad 8 spore a chromosome XII
A00470:566:HF2L2DRX3:1:1137:8811:13589_TATTCAGTAT,CP089111.1,100.0,Saccharomyces cerevisiae strain S288C-SK1-cross isolate tetrad 12 spore a chromosome XII
A00470:566:HF2L2DRX3:1:1137:8811:13589_TATTCAGTAT,CP006467.1,100.0,Saccharomyces cerevisiae YJM993 chromosome XII genomic sequence
A00470:566:HF2L2DRX3:1:1137:8811:13589_TATTCAGTAT,LR813545.2,100.0,"Saccharomyces cerevisiae strain Y55 genome assembly, chromosome: 12"
A00470:566:HF2L2DRX3:1:1137:8811:13589_TATTCAGTAT,LR813511.2,100.0,"Saccharomyces cerevisiae strain HLJ1 genome assembly, chromosome: 12"
A00470:566:HF2L2DRX3:1:1137:9498:19132_TGGCTTACAG,CP007490.1,98.75,"Rhodoluna lacicola strain MWH-Ta8 chromosome, complete genome"
A00470:566:HF2L2DRX3:1:1137:9498:19132_TGGCTTACAG,CP079107.1,96.25,"Paeniglutamicibacter sp. Y32M11 chromosome, complete genome"
A00470:566:HF2L2DRX3:1:1137:9498:19132_TGGCTTACAG,NR_076622.1,96.25,"Arthrobacter chlorophenolicus strain A6 23S ribosomal RNA gene, complete sequence"
A00470:566:HF2L2DRX3:1:1137:9498:19132_TGGCTTACAG,CP001341.1,96.25,"Pseudarthrobacter chlorophenolicus A6 chromosome, complete genome"
A00470:566:HF2L2DRX3:1:1137:9498:19132_TGGCTTACAG,CP082781.1,95.0,"Microbacterium resistens strain MZT7 chromosome, complete genome"
A00470:566:HF2L2DRX3:1:1139:32687:22310_CCCTACCCAG,NR_076313.1,100.0,"Rubrivivax gelatinosus strain IL144 23S ribosomal RNA gene, complete sequence"
A00470:566:HF2L2DRX3:1:1139:32687:22310_CCCTACCCAG,AP012320.1,100.0,"Rubrivivax gelatinosus IL144 DNA, complete genome"
A00470:566:HF2L2DRX3:1:1139:32687:22310_CCCTACCCAG,GU926628.1,100.0,"Uncultured bacterium clone F5K2Q4C04JJA34 23S ribosomal RNA gene, partial sequence"
A00470:566:HF2L2DRX3:1:1139:32687:22310_CCCTACCCAG,GU926296.1,100.0,"Uncultured bacterium clone F5K2Q4C04IPVZ7 23S ribosomal RNA gene, partial sequence"
A00470:566:HF2L2DRX3:1:1139:32687:22310_CCCTACCCAG,GU925394.1,100.0,"Uncultured bacterium clone F5K2Q4C04I2GB5 23S ribosomal RNA gene, partial sequence"
A00470:566:HF2L2DRX3:1:1139:9905:25755_CGGTACGAAC,GU925999.1,100.0,"Uncultured bacterium clone F5K2Q4C04JQ8L6 23S ribosomal RNA gene, partial sequence"
A00470:566:HF2L2DRX3:1:1139:9905:25755_CGGTACGAAC,AP012304.1,97.468,"Azoarcus sp. KH32C DNA, complete genome"
A00470:566:HF2L2DRX3:1:1139:9905:25755_CGGTACGAAC,CP071060.1,96.203,"Niveibacterium microcysteis strain HC41 chromosome, complete genome"
A00470:566:HF2L2DRX3:1:1139:9905:25755_CGGTACGAAC,NR_076998.1,94.937,"Aromatoleum aromaticum strain EbN1 23S ribosomal RNA gene, complete sequence"
A00470:566:HF2L2DRX3:1:1139:9905:25755_CGGTACGAAC,GU926684.1,94.937,"Uncultured bacterium clone F5K2Q4C04JAVAX 23S ribosomal RNA gene, partial sequence"
A00470:566:HF2L2DRX3:1:1114:31756:14685_AGACCACGGT,CP069370.1,98.684,"Neotabrizicola shimadae strain N10 chromosome, complete genome"
A00470:566:HF2L2DRX3:1:1114:31756:14685_AGACCACGGT,CP000144.2,98.684,"Rhodobacter sphaeroides 2.4.1 chromosome 2, complete sequence"
A00470:566:HF2L2DRX3:1:1114:31756:14685_AGACCACGGT,CP000143.2,98.684,"Rhodobacter sphaeroides 2.4.1 chromosome 1, complete sequence"
A00470:566:HF2L2DRX3:1:1114:31756:14685_AGACCACGGT,CP076366.1,98.684,"Gemmobacter fulvus strain con5 plasmid p5, complete sequence"
A00470:566:HF2L2DRX3:1:1114:31756:14685_AGACCACGGT,CP076361.1,98.684,"Gemmobacter fulvus strain con5 chromosome, complete genome"
A00470:566:HF2L2DRX3:1:1115:12436:21183_ACGCTAAACG,CP086020.1,100.0,"Weissella hellenica strain MBEL1842 chromosome, complete genome"
A00470:566:HF2L2DRX3:1:1115:12436:21183_ACGCTAAACG,CP080582.1,100.0,"Weissella confusa strain LM1 chromosome, complete genome"
A00470:566:HF2L2DRX3:1:1115:12436:21183_ACGCTAAACG,CP075544.1,100.0,"Weissella tructae strain W-1 chromosome, complete genome"
A00470:566:HF2L2DRX3:1:1115:12436:21183_ACGCTAAACG,CP074441.1,100.0,"Weissella ceti strain CECT 7719 chromosome, complete genome"
A00470:566:HF2L2DRX3:1:1115:12436:21183_ACGCTAAACG,CP065046.1,100.0,Weissella paramesenteroides strain STCH-BD1 chromosome
A00470:566:HF2L2DRX3:1:1115:25473:34272_CCCAGCGCAC,CP083898.1,97.059,"Zymomonas mobilis strain ZM481 chromosome, complete genome"
A00470:566:HF2L2DRX3:1:1115:25473:34272_CCCAGCGCAC,CP003715.1,97.059,"Zymomonas mobilis subsp. mobilis str. CP4 = NRRL B-14023, complete genome"
A00470:566:HF2L2DRX3:1:1115:25473:34272_CCCAGCGCAC,CP003709.1,97.059,"Zymomonas mobilis subsp. mobilis NRRL B-12526, complete genome"
A00470:566:HF2L2DRX3:1:1115:25473:34272_CCCAGCGCAC,CP006818.1,97.059,"Zymomonas mobilis subsp. mobilis str. CP4 = NRRL B-14023, complete genome"
A00470:566:HF2L2DRX3:1:1115:25473:34272_CCCAGCGCAC,CP080327.1,97.059,"Aquisediminimonas profunda strain DS48-3 chromosome, complete genome"
A00470:566:HF2L2DRX3:1:1115:27832:28839_ATCGCACCGT,JX455154.1,100.0,"Synura petersenii strain Youngji101407A 28S ribosomal RNA gene, partial sequence"
A00470:566:HF2L2DRX3:1:1115:27832:28839_ATCGCACCGT,JX455155.1,98.75,"Synura americana strain Johae010508F 28S ribosomal RNA gene, partial sequence"
A00470:566:HF2L2DRX3:1:1115:27832:28839_ATCGCACCGT,JX455153.1,100.0,"Synura glabra strain Dohak111107C 28S ribosomal RNA gene, partial sequence"
A00470:566:HF2L2DRX3:1:1115:27832:28839_ATCGCACCGT,OU943153.1,95.455,"uncultured fungus genomic DNA sequence contains 18S rRNA gene, ITS1, 5.8S rRNA gene, ITS2, 28S rRNA gene, isolate consensus04447"
A00470:566:HF2L2DRX3:1:1115:27832:28839_ATCGCACCGT,OU942864.1,95.455,"uncultured fungus genomic DNA sequence contains 18S rRNA gene, ITS1, 5.8S rRNA gene, ITS2, 28S rRNA gene, isolate consensus04159"
A00470:566:HF2L2DRX3:1:1116:25843:27054_CTCATAAGCC,JN129481.1,98.701,"Escherichia coli strain B1235 16S ribosomal RNA gene, partial sequence"
A00470:566:HF2L2DRX3:1:1116:25843:27054_CTCATAAGCC,MW332521.1,98.684,"Shigella boydii strain ME3 16S ribosomal RNA gene, partial sequence"
A00470:566:HF2L2DRX3:1:1116:25843:27054_CTCATAAGCC,HQ791492.1,97.436,"Uncultured organism clone ELU0124-T310-S-NI_000273 small subunit ribosomal RNA gene, partial sequence"
A00470:566:HF2L2DRX3:1:1116:25843:27054_CTCATAAGCC,CP089445.1,97.403,"Escherichia coli strain 5-1 chromosome, complete genome"
A00470:566:HF2L2DRX3:1:1116:25843:27054_CTCATAAGCC,OL826824.1,97.403,"Escherichia coli strain Samah 2021 16S ribosomal RNA gene, partial sequence"
A00470:566:HF2L2DRX3:1:1116:28962:1110_GGGCCTAAGT,CP089311.1,100.0,"Aureimonas altamirensis strain C2P003 chromosome, complete genome"
A00470:566:HF2L2DRX3:1:1116:28962:1110_GGGCCTAAGT,OL824923.1,100.0,"Agrobacterium deltaense strain PT316 16S ribosomal RNA gene, partial sequence"
A00470:566:HF2L2DRX3:1:1116:28962:1110_GGGCCTAAGT,OL824921.1,100.0,"Agrobacterium deltaense strain PT312 16S ribosomal RNA gene, partial sequence"
A00470:566:HF2L2DRX3:1:1116:28962:1110_GGGCCTAAGT,OL824916.1,100.0,"Agrobacterium deltaense strain PL319 16S ribosomal RNA gene, partial sequence"
A00470:566:HF2L2DRX3:1:1116:28962:1110_GGGCCTAAGT,OL824911.1,100.0,"Agrobacterium deltaense strain PL218 16S ribosomal RNA gene, partial sequence"
A00470:566:HF2L2DRX3:1:1117:28384:10410_CCCAAACACG,MW598343.1,100.0,"Herbaspirillum sp. strain CNPSo 3985 16S ribosomal RNA gene, partial sequence"
A00470:566:HF2L2DRX3:1:1117:28384:10410_CCCAAACACG,MW598340.1,100.0,"Herbaspirillum sp. strain CNPSo 3978 16S ribosomal RNA gene, partial sequence"
A00470:566:HF2L2DRX3:1:1117:28384:10410_CCCAAACACG,MW598338.1,100.0,"Herbaspirillum sp. strain CNPSo 3976 16S ribosomal RNA gene, partial sequence"
A00470:566:HF2L2DRX3:1:1117:28384:10410_CCCAAACACG,MW598320.1,100.0,"Herbaspirillum sp. strain CNPSo 3465 16S ribosomal RNA gene, partial sequence"
A00470:566:HF2L2DRX3:1:1117:28384:10410_CCCAAACACG,KJ767762.1,100.0,"Uncultured Herbaspirillum sp. clone K40-29 16S ribosomal RNA gene, partial sequence"
A00470:566:HF2L2DRX3:1:1117:5936:16814_CGACAATGAT,CP080582.1,100.0,"Weissella confusa strain LM1 chromosome, complete genome"
A00470:566:HF2L2DRX3:1:1117:5936:16814_CGACAATGAT,CP075544.1,100.0,"Weissella tructae strain W-1 chromosome, complete genome"
A00470:566:HF2L2DRX3:1:1117:5936:16814_CGACAATGAT,CP074441.1,100.0,"Weissella ceti strain CECT 7719 chromosome, complete genome"
A00470:566:HF2L2DRX3:1:1117:5936:16814_CGACAATGAT,NR_076901.1,100.0,"Weissella koreensis strain KACC 15510 23S ribosomal RNA gene, complete sequence"
A00470:566:HF2L2DRX3:1:1117:5936:16814_CGACAATGAT,CP043431.1,100.0,"Weissella koreensis strain SK chromosome, complete genome"
A00470:566:HF2L2DRX3:1:1141:20220:20040_AACACAAGAA,CP065359.1,96.875,"Ruegeria sp. SCSIO 43209 chromosome, complete genome"
A00470:566:HF2L2DRX3:1:1141:20220:20040_AACACAAGAA,CP000031.2,96.875,"Ruegeria pomeroyi DSS-3, complete genome"
A00470:566:HF2L2DRX3:1:1141:20220:20040_AACACAAGAA,CP076685.1,96.875,"Ruegeria pomeroyi strain DSS-3-B chromosome, complete genome"
A00470:566:HF2L2DRX3:1:1141:20220:20040_AACACAAGAA,CP051251.1,96.875,MAG: Pseudooceanicola nitratireducens isolate m3 chromosome
A00470:566:HF2L2DRX3:1:1141:20220:20040_AACACAAGAA,CP051233.1,96.875,MAG: Thalassovita sp. isolate m4 chromosome
A00470:566:HF2L2DRX3:1:1141:30138:8594_ACGACCCCGT,CP089313.1,100.0,"Salmonella enterica subsp. enterica serovar Indiana strain YZ21MCS4 chromosome, complete genome"
A00470:566:HF2L2DRX3:1:1141:30138:8594_ACGACCCCGT,CP089209.1,100.0,"Salmonella enterica strain S15 chromosome, complete genome"
A00470:566:HF2L2DRX3:1:1141:30138:8594_ACGACCCCGT,CP089207.1,100.0,"Salmonella enterica strain S639 chromosome, complete genome"
A00470:566:HF2L2DRX3:1:1141:30138:8594_ACGACCCCGT,CP081189.2,100.0,"Salmonella enterica strain sg1722-2 chromosome, complete genome"
A00470:566:HF2L2DRX3:1:1141:30138:8594_ACGACCCCGT,CP089142.1,100.0,"Escherichia coli strain XD35 chromosome, complete genome"
A00470:566:HF2L2DRX3:1:1142:19642:36793_CACACGCACA,MW674392.1,100.0,"Weissella confusa strain 19104 16S ribosomal RNA gene, partial sequence"
A00470:566:HF2L2DRX3:1:1142:19642:36793_CACACGCACA,OK513091.1,100.0,"Weissella soli strain T4 16S ribosomal RNA gene, partial sequence"
A00470:566:HF2L2DRX3:1:1142:19642:36793_CACACGCACA,OL762361.1,100.0,"Weissella confusa strain SM1 16S ribosomal RNA gene, partial sequence"
A00470:566:HF2L2DRX3:1:1142:19642:36793_CACACGCACA,OL762343.1,100.0,"Weissella paramesenteroides strain KH1016 16S ribosomal RNA gene, partial sequence"
A00470:566:HF2L2DRX3:1:1142:19642:36793_CACACGCACA,OL762334.1,100.0,"Weissella cibaria strain KH1006 16S ribosomal RNA gene, partial sequence"
A00470:566:HF2L2DRX3:1:1144:13575:3740_ATCCCGGCTG,CP082807.1,100.0,"Burkholderia contaminans strain SCAID TST1-2021 (11/270) chromosome 1, complete sequence"
A00470:566:HF2L2DRX3:1:1144:13575:3740_ATCCCGGCTG,CP073665.1,100.0,"Burkholderia contaminans strain toggle1 chromosome 2, complete sequence"
A00470:566:HF2L2DRX3:1:1144:13575:3740_ATCCCGGCTG,CP086304.1,97.468,"Burkholderia ambifaria strain B21-004 chromosome 1, complete sequence"
A00470:566:HF2L2DRX3:1:1144:13575:3740_ATCCCGGCTG,CP086301.1,97.468,"Burkholderia sp. B21-005 chromosome 1, complete sequence"
A00470:566:HF2L2DRX3:1:1144:13575:3740_ATCCCGGCTG,CP086294.1,97.468,"Burkholderia sp. B21-007 chromosome 1, complete sequence"
A00470:566:HF2L2DRX3:1:1110:11433:9831_AGCAGCACTA,CP089448.1,100.0,"Klebsiella michiganensis strain 8-1 chromosome, complete genome"
A00470:566:HF2L2DRX3:1:1110:11433:9831_AGCAGCACTA,CP089445.1,100.0,"Escherichia coli strain 5-1 chromosome, complete genome"
A00470:566:HF2L2DRX3:1:1110:11433:9831_AGCAGCACTA,CP089385.1,100.0,"Klebsiella variicola subsp. variicola strain KPN692 chromosome, complete genome"
A00470:566:HF2L2DRX3:1:1110:11433:9831_AGCAGCACTA,CP089315.1,100.0,"Klebsiella michiganensis strain K92 chromosome, complete genome"
A00470:566:HF2L2DRX3:1:1110:11433:9831_AGCAGCACTA,CP089313.1,100.0,"Salmonella enterica subsp. enterica serovar Indiana strain YZ21MCS4 chromosome, complete genome"
A00470:566:HF2L2DRX3:1:1110:1759:14559_CCAACACCAA,CP088017.1,100.0,"Ruania halotolerans strain M4N3S171 chromosome, complete genome"
A00470:566:HF2L2DRX3:1:1110:1759:14559_CCAACACCAA,CP088018.1,100.0,"Ruania suaedae strain LR1S40 chromosome, complete genome"
A00470:566:HF2L2DRX3:1:1110:1759:14559_CCAACACCAA,CP084585.1,100.0,"Cellulomonas iranensis strain ZJW-6 chromosome, complete genome"
A00470:566:HF2L2DRX3:1:1110:1759:14559_CCAACACCAA,CP081862.1,100.0,"Cellulomonas sp. C5510 chromosome, complete genome"
A00470:566:HF2L2DRX3:1:1110:1759:14559_CCAACACCAA,CP076023.1,100.0,"Cellulomonas dongxiuzhuiae strain zg-ZUI157 chromosome, complete genome"
A00470:566:HF2L2DRX3:1:1110:21061:13416_TGCCATCACA,CP088955.1,100.0,"Acinetobacter calcoaceticus strain ARu19 chromosome, complete genome"
A00470:566:HF2L2DRX3:1:1110:21061:13416_TGCCATCACA,CP088954.1,100.0,"Acinetobacter calcoaceticus strain ACa13 chromosome, complete genome"
A00470:566:HF2L2DRX3:1:1110:21061:13416_TGCCATCACA,CP087716.1,100.0,"Acinetobacter pittii strain AP2044 chromosome, complete genome"
A00470:566:HF2L2DRX3:1:1110:21061:13416_TGCCATCACA,CP087594.1,100.0,"Acinetobacter baumannii strain SHOU-Ab01 chromosome, complete genome"
A00470:566:HF2L2DRX3:1:1110:21061:13416_TGCCATCACA,CP074710.1,100.0,"Acinetobacter baumannii strain ATCC 17978 chromosome, complete genome"
A00470:566:HF2L2DRX3:1:1110:32723:26099_CTCCATATCA,EF632937.1,100.0,"Uncultured bacterium clone Pia-s-55 16S ribosomal RNA gene, partial sequence"
A00470:566:HF2L2DRX3:1:1110:32723:26099_CTCCATATCA,JF907240.1,98.734,"Uncultured bacterium clone 211 16S ribosomal RNA gene, partial sequence"
A00470:566:HF2L2DRX3:1:1110:32723:26099_CTCCATATCA,KJ147073.1,98.734,"Sphaerotilus natans isolate OTU-c66 16S ribosomal RNA gene, partial sequence"
A00470:566:HF2L2DRX3:1:1110:32723:26099_CTCCATATCA,KF827207.1,98.734,"Uncultured beta proteobacterium clone O-5-16 16S ribosomal RNA gene, partial sequence"
A00470:566:HF2L2DRX3:1:1110:32723:26099_CTCCATATCA,JQ946031.1,98.734,"Leptothrix sp. W_153 16S ribosomal RNA gene, partial sequence"
A00470:566:HF2L2DRX3:1:1111:13810:30170_GACAACGACC,CP082808.1,100.0,"Burkholderia contaminans strain SCAID TST1-2021 (11/270) chromosome 2, complete sequence"
A00470:566:HF2L2DRX3:1:1111:13810:30170_GACAACGACC,CP073667.1,100.0,"Burkholderia contaminans strain toggle1 chromosome 3, complete sequence"
A00470:566:HF2L2DRX3:1:1111:13810:30170_GACAACGACC,CP000152.1,97.468,"Burkholderia lata strain 383 chromosome 2, complete sequence"
A00470:566:HF2L2DRX3:1:1111:13810:30170_GACAACGACC,CP004384.1,96.203,"Burkholderia thailandensis USAMRU Malaysia #20 chromosome 2, complete sequence"
A00470:566:HF2L2DRX3:1:1111:13810:30170_GACAACGACC,CP004118.1,96.203,"Burkholderia thailandensis E444 chromosome 2, complete sequence"
A00470:566:HF2L2DRX3:1:1111:3784:13369_GATGCCAGTG,HG818144.1,100.0,"Uncultured bacterium partial 16S rRNA gene, clone EBP0168"
A00470:566:HF2L2DRX3:1:1111:3784:13369_GATGCCAGTG,KF248746.1,100.0,"Uncultured Burkholderia sp. clone ANWE12M 16S ribosomal RNA gene, partial sequence"
A00470:566:HF2L2DRX3:1:1111:3784:13369_GATGCCAGTG,KF248714.1,100.0,"Uncultured Burkholderia sp. clone ANWH12Y 16S ribosomal RNA gene, partial sequence"
A00470:566:HF2L2DRX3:1:1111:3784:13369_GATGCCAGTG,KF248706.1,100.0,"Uncultured Burkholderia sp. clone ANWF6Z 16S ribosomal RNA gene, partial sequence"
A00470:566:HF2L2DRX3:1:1111:3784:13369_GATGCCAGTG,KF248699.1,100.0,"Uncultured Burkholderia sp. clone ANWE6Z 16S ribosomal RNA gene, partial sequence"
A00470:566:HF2L2DRX3:1:1111:6931:29653_AGGCCACTCC,AK125681.1,89.333,"Homo sapiens cDNA FLJ43693 fis, clone TBAES2005543"
A00470:566:HF2L2DRX3:1:1111:6931:29653_AGGCCACTCC,AC254634.1,97.674,"Homo sapiens BAC clone CH17-267E14 from chromosome 16, complete sequence"
A00470:566:HF2L2DRX3:1:1111:6931:29653_AGGCCACTCC,CP068262.2,97.674,Homo sapiens isolate CHM13 chromosome 16
A00470:566:HF2L2DRX3:1:1111:6931:29653_AGGCCACTCC,AC247031.2,97.674,"Homo sapiens BAC clone CH17-442J12 from chromosome unknown, complete sequence"
A00470:566:HF2L2DRX3:1:1111:6931:29653_AGGCCACTCC,AC243983.3,97.674,"Homo sapiens BAC clone CH17-38C6 from chromosome unknown, complete sequence"
A00470:566:HF2L2DRX3:1:1112:12219:24659_TCCCCCGACG,CP089445.1,100.0,"Escherichia coli strain 5-1 chromosome, complete genome"
A00470:566:HF2L2DRX3:1:1112:12219:24659_TCCCCCGACG,CP089385.1,100.0,"Klebsiella variicola subsp. variicola strain KPN692 chromosome, complete genome"
A00470:566:HF2L2DRX3:1:1112:12219:24659_TCCCCCGACG,OL826824.1,100.0,"Escherichia coli strain Samah 2021 16S ribosomal RNA gene, partial sequence"
A00470:566:HF2L2DRX3:1:1112:12219:24659_TCCCCCGACG,OL825738.1,100.0,"Escherichia coli strain Wafaa2021 16S ribosomal RNA gene, partial sequence"
A00470:566:HF2L2DRX3:1:1112:12219:24659_TCCCCCGACG,OL824933.1,100.0,"Serratia marcescens strain ST212 16S ribosomal RNA gene, partial sequence"
A00470:566:HF2L2DRX3:1:1112:4634:25238_CGTCAGGGCA,CP089128.1,100.0,Saccharomyces cerevisiae strain S288C-SK1-cross isolate tetrad 8 spore a chromosome XII
A00470:566:HF2L2DRX3:1:1112:4634:25238_CGTCAGGGCA,CP089111.1,100.0,Saccharomyces cerevisiae strain S288C-SK1-cross isolate tetrad 12 spore a chromosome XII
A00470:566:HF2L2DRX3:1:1112:4634:25238_CGTCAGGGCA,CP088321.1,100.0,Saccharomyces cerevisiae strain F chromosome XII
A00470:566:HF2L2DRX3:1:1112:4634:25238_CGTCAGGGCA,CP088312.1,100.0,Saccharomyces cerevisiae strain A chromosome XII
A00470:566:HF2L2DRX3:1:1112:4634:25238_CGTCAGGGCA,7OSA_25S,100.0,"Chain 25S, 25S rRNA"
A00470:566:HF2L2DRX3:1:1113:32832:26162_TCCATGGCTA,JQ906300.1,98.718,"Uncultured bacterium clone BloS7-012 16S ribosomal RNA gene, partial sequence"
A00470:566:HF2L2DRX3:1:1113:32832:26162_TCCATGGCTA,GU393438.1,98.718,"Uncultured bacterium clone NPR-HI-67 16S ribosomal RNA gene, partial sequence"
A00470:566:HF2L2DRX3:1:1113:32832:26162_TCCATGGCTA,FJ517018.1,98.718,"Uncultured Rhodocylaceae bacterium clone TDNP_Wbc97_146_1_49 16S ribosomal RNA gene, partial sequence"
A00470:566:HF2L2DRX3:1:1113:32832:26162_TCCATGGCTA,EF516772.1,98.718,"Uncultured bacterium clone FCPP576 16S ribosomal RNA gene, complete sequence"
A00470:566:HF2L2DRX3:1:1113:32832:26162_TCCATGGCTA,AY212655.1,98.718,"Uncultured bacterium clone 209ds20 16S ribosomal RNA gene, partial sequence"
A00470:566:HF2L2DRX3:1:1146:16441:23610_AACGCCATCA,CP089448.1,100.0,"Klebsiella michiganensis strain 8-1 chromosome, complete genome"
A00470:566:HF2L2DRX3:1:1146:16441:23610_AACGCCATCA,CP089445.1,100.0,"Escherichia coli strain 5-1 chromosome, complete genome"
A00470:566:HF2L2DRX3:1:1146:16441:23610_AACGCCATCA,CP089385.1,100.0,"Klebsiella variicola subsp. variicola strain KPN692 chromosome, complete genome"
A00470:566:HF2L2DRX3:1:1146:16441:23610_AACGCCATCA,CP089315.1,100.0,"Klebsiella michiganensis strain K92 chromosome, complete genome"
A00470:566:HF2L2DRX3:1:1146:16441:23610_AACGCCATCA,CP089411.1,100.0,"Klebsiella oxytoca strain Kox100 chromosome, complete genome"
A00470:566:HF2L2DRX3:1:1146:30337:8813_ATGATACCTG,NR_076749.1,100.0,"Herbaspirillum seropedicae strain SmR1 23S ribosomal RNA gene, complete sequence"
A00470:566:HF2L2DRX3:1:1146:30337:8813_ATGATACCTG,CP049139.1,100.0,"Herbaspirillum frisingense strain IAC152 chromosome, complete genome"
A00470:566:HF2L2DRX3:1:1146:30337:8813_ATGATACCTG,CP002039.1,100.0,"Herbaspirillum seropedicae SmR1, complete genome"
A00470:566:HF2L2DRX3:1:1146:30337:8813_ATGATACCTG,KF422128.1,98.734,Uncultured Polaromonas sp. clone VostokV6_c16 genomic sequence
A00470:566:HF2L2DRX3:1:1146:30337:8813_ATGATACCTG,CP088968.1,97.468,Janthinobacterium sp. PLB04 chromosome
A00470:566:HF2L2DRX3:1:1146:31087:29121_GGAGGGTATG,AF186596.1,98.734,"Cyclidiopsis acus 5S ribosomal RNA and SL-RNA genes, complete sequence"
A00470:566:HF2L2DRX3:1:1146:31087:29121_GGAGGGTATG,AF186595.1,98.734,"Phacus curvicauda 5S ribosomal RNA and SL-RNA genes, complete sequence"
A00470:566:HF2L2DRX3:1:1146:31087:29121_GGAGGGTATG,6ZJ3_LO,97.468,"Chain LO, 5S rRNA"
A00470:566:HF2L2DRX3:1:1146:31087:29121_GGAGGGTATG,X01484.1,97.468,Euglena gracilis 5S ribosomal RNA
A00470:566:HF2L2DRX3:1:1146:31087:29121_GGAGGGTATG,X02031.1,94.937,Euglena gracilis 5S ribosomal RNA
A00470:566:HF2L2DRX3:1:1147:15700:30091_GGGCTATACA,CP003969.1,98.592,"Sorangium cellulosum So0157-2, complete genome"
A00470:566:HF2L2DRX3:1:1147:15700:30091_GGGCTATACA,NR_103018.1,98.592,"Sorangium cellulosum strain So ce 56 23S ribosomal RNA gene, complete sequence"
A00470:566:HF2L2DRX3:1:1147:15700:30091_GGGCTATACA,GU925838.1,98.592,"Uncultured bacterium clone F5K2Q4C04I56M6 23S ribosomal RNA gene, partial sequence"
A00470:566:HF2L2DRX3:1:1147:15700:30091_GGGCTATACA,GU925806.1,98.592,"Uncultured bacterium clone F5K2Q4C04JFHTC 23S ribosomal RNA gene, partial sequence"
A00470:566:HF2L2DRX3:1:1147:15700:30091_GGGCTATACA,GU925466.1,98.592,"Uncultured bacterium clone F5K2Q4C04IE5BL 23S ribosomal RNA gene, partial sequence"
A00470:566:HF2L2DRX3:1:1148:22263:27117_GATCCCACAC,CP068261.2,98.718,Homo sapiens isolate CHM13 chromosome 17
A00470:566:HF2L2DRX3:1:1148:22263:27117_GATCCCACAC,AC240494.3,98.718,"Homo sapiens FOSMID clone ABC27-1699K9 from chromosome 17, complete sequence"
A00470:566:HF2L2DRX3:1:1148:22263:27117_GATCCCACAC,AC231537.2,98.718,"Homo sapiens FOSMID clone ABC11-48241000M2 from chromosome unknown, complete sequence"
A00470:566:HF2L2DRX3:1:1148:22263:27117_GATCCCACAC,NR_006881.1,98.718,"Homo sapiens small nucleolar RNA, C/D box 3C (SNORD3C), small nucleolar RNA"
A00470:566:HF2L2DRX3:1:1148:22263:27117_GATCCCACAC,NR_006880.1,98.718,"Homo sapiens small nucleolar RNA, C/D box 3A (SNORD3A), small nucleolar RNA"
A00470:566:HF2L2DRX3:1:1119:10077:2942_TCCTCCTTCA,CP086020.1,100.0,"Weissella hellenica strain MBEL1842 chromosome, complete genome"
A00470:566:HF2L2DRX3:1:1119:10077:2942_TCCTCCTTCA,CP080582.1,100.0,"Weissella confusa strain LM1 chromosome, complete genome"
A00470:566:HF2L2DRX3:1:1119:10077:2942_TCCTCCTTCA,CP075544.1,100.0,"Weissella tructae strain W-1 chromosome, complete genome"
A00470:566:HF2L2DRX3:1:1119:10077:2942_TCCTCCTTCA,CP074441.1,100.0,"Weissella ceti strain CECT 7719 chromosome, complete genome"
A00470:566:HF2L2DRX3:1:1119:10077:2942_TCCTCCTTCA,CP065046.1,100.0,Weissella paramesenteroides strain STCH-BD1 chromosome
A00470:566:HF2L2DRX3:1:1119:32362:6089_AGGCTAAACA,CP089448.1,100.0,"Klebsiella michiganensis strain 8-1 chromosome, complete genome"
