qseqid,sseqid,pident,sseq_name
A00470:566:HF2L2DRX3:2:2114:31186:16986_AACCCCCGCA,CP085529.1,100.0,"Chryseobacterium indologenes strain 742 chromosome, complete genome"
A00470:566:HF2L2DRX3:2:2114:31186:16986_AACCCCCGCA,CP067044.1,100.0,"Chryseobacterium indologenes strain 3125 chromosome, complete genome"
A00470:566:HF2L2DRX3:2:2114:31186:16986_AACCCCCGCA,CP065590.1,100.0,"Chryseobacterium indologenes strain DSM 16777 chromosome, complete genome"
A00470:566:HF2L2DRX3:2:2114:31186:16986_AACCCCCGCA,CP087583.1,97.5,"Chryseobacterium faecale strain F4 chromosome, complete genome"
A00470:566:HF2L2DRX3:2:2114:31186:16986_AACCCCCGCA,CP087131.1,97.5,"Chryseobacterium turcicum strain C-17 chromosome, complete genome"
A00470:566:HF2L2DRX3:2:2114:5122:21136_GATAGAACCC,CP086020.1,100.0,"Weissella hellenica strain MBEL1842 chromosome, complete genome"
A00470:566:HF2L2DRX3:2:2114:5122:21136_GATAGAACCC,CP080582.1,100.0,"Weissella confusa strain LM1 chromosome, complete genome"
A00470:566:HF2L2DRX3:2:2114:5122:21136_GATAGAACCC,CP075544.1,100.0,"Weissella tructae strain W-1 chromosome, complete genome"
A00470:566:HF2L2DRX3:2:2114:5122:21136_GATAGAACCC,CP074441.1,100.0,"Weissella ceti strain CECT 7719 chromosome, complete genome"
A00470:566:HF2L2DRX3:2:2114:5122:21136_GATAGAACCC,NR_076901.1,100.0,"Weissella koreensis strain KACC 15510 23S ribosomal RNA gene, complete sequence"
A00470:566:HF2L2DRX3:2:1260:20509:7106_GAACTTAGAG,OL824922.1,100.0,"Paraburkholderia fungorum strain PT315 16S ribosomal RNA gene, partial sequence"
A00470:566:HF2L2DRX3:2:1260:20509:7106_GAACTTAGAG,OL824910.1,100.0,"Paraburkholderia fungorum strain PL215 16S ribosomal RNA gene, partial sequence"
A00470:566:HF2L2DRX3:2:1260:20509:7106_GAACTTAGAG,OL824902.1,100.0,"Paraburkholderia fungorum strain PL117 16S ribosomal RNA gene, partial sequence"
A00470:566:HF2L2DRX3:2:1260:20509:7106_GAACTTAGAG,OL824889.1,100.0,"Paraburkholderia fungorum strain OL304 16S ribosomal RNA gene, partial sequence"
A00470:566:HF2L2DRX3:2:1260:20509:7106_GAACTTAGAG,OL824883.1,100.0,"Paraburkholderia fungorum strain GT318 16S ribosomal RNA gene, partial sequence"
A00470:566:HF2L2DRX3:2:1261:29523:1266_AGCCAGCCCG,CP004384.1,100.0,"Burkholderia thailandensis USAMRU Malaysia #20 chromosome 2, complete sequence"
A00470:566:HF2L2DRX3:2:1261:29523:1266_AGCCAGCCCG,CP004383.1,100.0,"Burkholderia thailandensis USAMRU Malaysia #20 chromosome 1, complete sequence"
A00470:566:HF2L2DRX3:2:1261:29523:1266_AGCCAGCCCG,HG938371.2,100.0,"Burkholderia cenocepacia H111 chromosome 2, complete genome"
A00470:566:HF2L2DRX3:2:1261:29523:1266_AGCCAGCCCG,CP086006.1,100.0,Burkholderia dolosa strain FDAARGOS_1545 chromosome 1
A00470:566:HF2L2DRX3:2:1261:29523:1266_AGCCAGCCCG,CP086005.1,100.0,Burkholderia dolosa strain FDAARGOS_1545 chromosome 2
A00470:566:HF2L2DRX3:2:2117:25319:21386_CATAGAGAAG,CP076413.1,100.0,"Ralstonia wenshanensis strain 56D2 chromosome, complete genome"
A00470:566:HF2L2DRX3:2:2117:25319:21386_CATAGAGAAG,CP076412.1,100.0,"Ralstonia wenshanensis strain 56D2 plasmid p56D2, complete sequence"
A00470:566:HF2L2DRX3:2:2117:25319:21386_CATAGAGAAG,CP088237.1,100.0,Ralstonia solanacearum strain UW251 chromosome
A00470:566:HF2L2DRX3:2:2117:25319:21386_CATAGAGAAG,CP088235.1,100.0,Ralstonia solanacearum strain CIP417_UW70 chromosome
A00470:566:HF2L2DRX3:2:2117:25319:21386_CATAGAGAAG,CP088233.1,100.0,Ralstonia solanacearum strain UW72 chromosome
A00470:566:HF2L2DRX3:2:2119:18873:12571_AGCAGAACTG,CP086727.1,100.0,"Parasphingorhabdus litoris DSM 22379 chromosome, complete genome"
A00470:566:HF2L2DRX3:2:2119:18873:12571_AGCAGAACTG,NR_122018.1,100.0,"Sphingomonas sanxanigenens strain NX02 23S ribosomal RNA gene, complete sequence"
A00470:566:HF2L2DRX3:2:2119:18873:12571_AGCAGAACTG,KJ693608.1,100.0,Uncultured bacterium clone S08_CY_56 genomic sequence
A00470:566:HF2L2DRX3:2:2119:18873:12571_AGCAGAACTG,CP086594.1,100.0,"Sphingomonas radiodurans strain S9-5 chromosome, complete genome"
A00470:566:HF2L2DRX3:2:2119:18873:12571_AGCAGAACTG,CP082839.1,100.0,"Sphingomonas nostoxanthinifaciens strain AK-PDB1-5 chromosome, complete genome"
A00470:566:HF2L2DRX3:2:2120:7120:27226_GACAAGAGAT,MW598366.1,98.701,"Herbaspirillum sp. strain CNPSo 4064 16S ribosomal RNA gene, partial sequence"
A00470:566:HF2L2DRX3:2:2120:7120:27226_GACAAGAGAT,MW598347.1,98.701,"Herbaspirillum sp. strain CNPSo 3990 16S ribosomal RNA gene, partial sequence"
A00470:566:HF2L2DRX3:2:2120:7120:27226_GACAAGAGAT,MW598321.1,98.701,"Herbaspirillum sp. strain CNPSo 3468 16S ribosomal RNA gene, partial sequence"
A00470:566:HF2L2DRX3:2:2120:7120:27226_GACAAGAGAT,KF557648.1,98.701,"Uncultured bacterium clone G(3M)26 16S ribosomal RNA gene, partial sequence"
A00470:566:HF2L2DRX3:2:2120:7120:27226_GACAAGAGAT,KF071073.1,98.701,"Uncultured bacterium clone ncd190c07c1 16S ribosomal RNA gene, partial sequence"
A00470:566:HF2L2DRX3:2:2121:24975:5854_ACGCCCAGGT,HQ690782.1,100.0,"Uncultured bacterium isolate DGGE gel band RTGwells_8 16S ribosomal RNA gene, partial sequence"
A00470:566:HF2L2DRX3:2:2121:24975:5854_ACGCCCAGGT,OL774679.1,100.0,"Collimonas pratensis strain MP-22 16S ribosomal RNA gene, partial sequence"
A00470:566:HF2L2DRX3:2:2121:24975:5854_ACGCCCAGGT,LR983296.1,100.0,uncultured bacterium partial 16S rRNA gene
A00470:566:HF2L2DRX3:2:2121:24975:5854_ACGCCCAGGT,LR980221.1,100.0,uncultured bacterium partial 16S rRNA gene
A00470:566:HF2L2DRX3:2:2121:24975:5854_ACGCCCAGGT,LR978097.1,100.0,uncultured Betaproteobacteria partial 16S rRNA gene
A00470:566:HF2L2DRX3:2:2121:31367:24940_GTAGCACCTG,OL672318.1,100.0,"Acinetobacter sp. strain BA9 16S ribosomal RNA gene, partial sequence"
A00470:566:HF2L2DRX3:2:2121:31367:24940_GTAGCACCTG,KF611935.1,100.0,"Uncultured bacterium clone D14_45 16S ribosomal RNA gene, partial sequence"
A00470:566:HF2L2DRX3:2:2121:31367:24940_GTAGCACCTG,KJ848594.1,100.0,"Acinetobacter lwoffii strain BT 90 16S ribosomal RNA gene, partial sequence"
A00470:566:HF2L2DRX3:2:2121:31367:24940_GTAGCACCTG,KJ848561.1,100.0,"Prolinoborus fasciculus strain BT 28 16S ribosomal RNA gene, partial sequence"
A00470:566:HF2L2DRX3:2:2121:31367:24940_GTAGCACCTG,KJ848559.1,100.0,"Prolinoborus fasciculus strain BT 25 16S ribosomal RNA gene, partial sequence"
A00470:566:HF2L2DRX3:2:2150:9778:12352_CCCTCCCCCC,CP088273.1,95.161,"Phyllobacterium sp. T1293 chromosome, complete genome"
A00470:566:HF2L2DRX3:2:2151:26178:22717_TAAAGGTTAT,FJ747424.1,100.0,"Uncultured fungus clone Aero6_C09 18S ribosomal RNA gene, partial sequence"
A00470:566:HF2L2DRX3:2:2151:26178:22717_TAAAGGTTAT,CP089128.1,98.718,Saccharomyces cerevisiae strain S288C-SK1-cross isolate tetrad 8 spore a chromosome XII
A00470:566:HF2L2DRX3:2:2151:26178:22717_TAAAGGTTAT,CP089111.1,98.718,Saccharomyces cerevisiae strain S288C-SK1-cross isolate tetrad 12 spore a chromosome XII
A00470:566:HF2L2DRX3:2:2151:26178:22717_TAAAGGTTAT,CP088321.1,98.718,Saccharomyces cerevisiae strain F chromosome XII
A00470:566:HF2L2DRX3:2:2151:26178:22717_TAAAGGTTAT,CP088312.1,98.718,Saccharomyces cerevisiae strain A chromosome XII
A00470:566:HF2L2DRX3:2:1264:5529:27383_CAGCAAACAT,CP064984.1,92.647,MAG: Sphingobacteriales bacterium isolate Fred_18-Q3-R57-64_BATAC.414 chromosome
A00470:566:HF2L2DRX3:2:1264:5529:27383_CAGCAAACAT,CP087135.1,91.429,"Flavobacterium sp. F-340 chromosome, complete genome"
A00470:566:HF2L2DRX3:2:1264:5529:27383_CAGCAAACAT,OU957226.1,91.429,"Flavobacterium sp. CECT 9288 genome assembly, chromosome: 1"
A00470:566:HF2L2DRX3:2:1264:5529:27383_CAGCAAACAT,AP025185.1,91.429,"Flavobacterium ammonificans SHINM13 DNA, complete genome"
A00470:566:HF2L2DRX3:2:1264:5529:27383_CAGCAAACAT,AP025184.1,91.429,"Flavobacterium ammoniigenes GENT5 DNA, complete genome"
A00470:566:HF2L2DRX3:2:1264:9073:33552_TTTATCCTAG,AP023423.1,100.0,"Sideroxyarcus emersonii MIZ01 DNA, complete genome"
A00470:566:HF2L2DRX3:2:1264:9073:33552_TTTATCCTAG,NR_121987.1,100.0,"Castellaniella defragrans strain 65Phen 23S ribosomal RNA gene, complete sequence"
A00470:566:HF2L2DRX3:2:1264:9073:33552_TTTATCCTAG,NR_121964.1,100.0,"Pandoraea pnomenusa strain 3kgm 23S ribosomal RNA gene, complete sequence"
A00470:566:HF2L2DRX3:2:1264:9073:33552_TTTATCCTAG,CP004384.1,100.0,"Burkholderia thailandensis USAMRU Malaysia #20 chromosome 2, complete sequence"
A00470:566:HF2L2DRX3:2:1264:9073:33552_TTTATCCTAG,CP004383.1,100.0,"Burkholderia thailandensis USAMRU Malaysia #20 chromosome 1, complete sequence"
A00470:566:HF2L2DRX3:2:1265:29866:30984_CACTAGAATC,CP089303.1,100.0,"Limosilactobacillus reuteri strain VHProbi M07 chromosome, complete genome"
A00470:566:HF2L2DRX3:2:1265:29866:30984_CACTAGAATC,CP088931.1,100.0,"Limosilactobacillus reuteri strain VHProbi E18 chromosome, complete genome"
A00470:566:HF2L2DRX3:2:1265:29866:30984_CACTAGAATC,CP065852.1,100.0,Limosilactobacillus reuteri isolate 3632 plasmid unnamed3
A00470:566:HF2L2DRX3:2:1265:29866:30984_CACTAGAATC,CP065849.1,100.0,Limosilactobacillus reuteri isolate 3632 chromosome
A00470:566:HF2L2DRX3:2:1265:29866:30984_CACTAGAATC,CP065330.1,100.0,Limosilactobacillus reuteri isolate 3630 chromosome
A00470:566:HF2L2DRX3:2:2122:20066:22404_CGTTAGAAAT,OK602686.1,100.0,"Aquabacterium sp. strain RJY3 16S ribosomal RNA gene, partial sequence"
A00470:566:HF2L2DRX3:2:2122:20066:22404_CGTTAGAAAT,KF956464.1,100.0,"Uncultured beta proteobacterium clone NS-OTU35 16S ribosomal RNA gene, partial sequence"
A00470:566:HF2L2DRX3:2:2122:20066:22404_CGTTAGAAAT,KF956432.1,100.0,"Uncultured beta proteobacterium clone NS-OTU3 16S ribosomal RNA gene, partial sequence"
A00470:566:HF2L2DRX3:2:2122:20066:22404_CGTTAGAAAT,KF916775.1,100.0,"Uncultured bacterium clone SL-0084 16S ribosomal RNA gene, partial sequence"
A00470:566:HF2L2DRX3:2:2122:20066:22404_CGTTAGAAAT,KF875599.1,100.0,"Uncultured bacterium clone 1-110 16S ribosomal RNA gene, partial sequence"
A00470:566:HF2L2DRX3:2:2122:2076:37059_CTCATATTGT,CP088081.1,98.529,"Ideonella dechloratans strain CCUG 30977 chromosome, complete genome"
A00470:566:HF2L2DRX3:2:2122:2076:37059_CTCATATTGT,AP024238.1,98.529,"Rhodoferax sp. MIZ03 DNA, complete genome"
A00470:566:HF2L2DRX3:2:2122:2076:37059_CTCATATTGT,CP059067.1,98.529,Rhizobacter sp. AJA081-3 chromosome
A00470:566:HF2L2DRX3:2:2122:2076:37059_CTCATATTGT,NR_076570.1,98.529,"Leptothrix cholodnii strain SP-6 23S ribosomal RNA gene, complete sequence"
A00470:566:HF2L2DRX3:2:2122:2076:37059_CTCATATTGT,NR_076409.1,98.529,"Rhodoferax ferrireducens strain T118 23S ribosomal RNA gene, complete sequence"
A00470:566:HF2L2DRX3:2:2123:12093:3239_GAATTACACG,CP088081.1,100.0,"Ideonella dechloratans strain CCUG 30977 chromosome, complete genome"
A00470:566:HF2L2DRX3:2:2123:12093:3239_GAATTACACG,GU925476.1,100.0,"Uncultured bacterium clone F5K2Q4C04J296D 23S ribosomal RNA gene, partial sequence"
A00470:566:HF2L2DRX3:2:2123:12093:3239_GAATTACACG,GU925409.1,100.0,"Uncultured bacterium clone F5K2Q4C04IY2VX 23S ribosomal RNA gene, partial sequence"
A00470:566:HF2L2DRX3:2:2123:12093:3239_GAATTACACG,GU925394.1,100.0,"Uncultured bacterium clone F5K2Q4C04I2GB5 23S ribosomal RNA gene, partial sequence"
A00470:566:HF2L2DRX3:2:2123:12093:3239_GAATTACACG,GU925066.1,100.0,"Uncultured bacterium clone F5K2Q4C04H8PU3 23S ribosomal RNA gene, partial sequence"
A00470:566:HF2L2DRX3:2:2125:1723:15749_ATCGGCCGCG,DQ115522.1,97.059,"Candida rugosa 5S ribosomal RNA gene, partial sequence"
A00470:566:HF2L2DRX3:2:2126:11668:26897_CTGACCATAG,CP089131.1,98.0,Saccharomyces cerevisiae strain S288C-SK1-cross isolate tetrad 8 spore a chromosome XV
A00470:566:HF2L2DRX3:2:2126:11668:26897_CTGACCATAG,CP089129.1,98.0,Saccharomyces cerevisiae strain S288C-SK1-cross isolate tetrad 8 spore a chromosome XIII
A00470:566:HF2L2DRX3:2:2126:11668:26897_CTGACCATAG,CP089128.1,98.0,Saccharomyces cerevisiae strain S288C-SK1-cross isolate tetrad 8 spore a chromosome XII
A00470:566:HF2L2DRX3:2:2126:11668:26897_CTGACCATAG,CP089127.1,98.0,Saccharomyces cerevisiae strain S288C-SK1-cross isolate tetrad 8 spore a chromosome XI
A00470:566:HF2L2DRX3:2:2126:11668:26897_CTGACCATAG,CP089126.1,98.0,Saccharomyces cerevisiae strain S288C-SK1-cross isolate tetrad 8 spore a chromosome X
A00470:566:HF2L2DRX3:2:2126:20003:6731_CCTCCACCGT,LC661719.1,100.0,"Burkholderia sp. JF15 gene for 16S rRNA, partial sequence"
A00470:566:HF2L2DRX3:2:2126:20003:6731_CCTCCACCGT,LC661712.1,100.0,"Burkholderia sp. JA6 gene for 16S rRNA, partial sequence"
A00470:566:HF2L2DRX3:2:2126:20003:6731_CCTCCACCGT,OK236184.1,100.0,"Burkholderia sp. strain 495 16S ribosomal RNA gene, partial sequence"
A00470:566:HF2L2DRX3:2:2126:20003:6731_CCTCCACCGT,KF108220.1,100.0,"Uncultured bacterium clone ncm68f02c1 16S ribosomal RNA gene, partial sequence"
A00470:566:HF2L2DRX3:2:2126:20003:6731_CCTCCACCGT,KF108135.1,100.0,"Uncultured bacterium clone ncm67d05c1 16S ribosomal RNA gene, partial sequence"
A00470:566:HF2L2DRX3:2:2159:22010:2284_AGAGGTCCAG,CP089120.1,100.0,Saccharomyces cerevisiae strain S288C-SK1-cross isolate tetrad 8 spore a chromosome IV
A00470:566:HF2L2DRX3:2:2159:22010:2284_AGAGGTCCAG,CP089103.1,100.0,Saccharomyces cerevisiae strain S288C-SK1-cross isolate tetrad 12 spore a chromosome IV
A00470:566:HF2L2DRX3:2:2159:22010:2284_AGAGGTCCAG,CP088318.1,100.0,Saccharomyces cerevisiae strain F chromosome IV
A00470:566:HF2L2DRX3:2:2159:22010:2284_AGAGGTCCAG,CP088304.1,100.0,Saccharomyces cerevisiae strain A chromosome IV
A00470:566:HF2L2DRX3:2:2159:22010:2284_AGAGGTCCAG,CP081969.2,100.0,"Mutant Saccharomyces paradoxus strain 337 chromosome IV genomic sequence, sequence"
A00470:566:HF2L2DRX3:2:2160:10981:16188_GCAGCACCAT,CP002039.1,100.0,"Herbaspirillum seropedicae SmR1, complete genome"
A00470:566:HF2L2DRX3:2:2160:10981:16188_GCAGCACCAT,CP049139.1,97.436,"Herbaspirillum frisingense strain IAC152 chromosome, complete genome"
A00470:566:HF2L2DRX3:2:2160:10981:16188_GCAGCACCAT,CP002745.1,97.436,"Collimonas fungivorans Ter331 chromosome, complete genome"
A00470:566:HF2L2DRX3:2:2160:10981:16188_GCAGCACCAT,CP000269.1,97.436,"Janthinobacterium sp. Marseille, complete genome"
A00470:566:HF2L2DRX3:2:2160:10981:16188_GCAGCACCAT,CU207211.1,97.436,"Herminiimonas arsenicoxydans chromosome, complete sequence"
A00470:566:HF2L2DRX3:2:2160:15004:32487_ATTAGCAGGT,AC231850.2,100.0,"Homo sapiens FOSMID clone ABC13-49744700A3 from chromosome unknown, complete sequence"
A00470:566:HF2L2DRX3:2:2160:15004:32487_ATTAGCAGGT,BX890604.9,100.0,"Human DNA sequence from clone RP11-706O15 on chromosome X, complete sequence"
A00470:566:HF2L2DRX3:2:2160:15004:32487_ATTAGCAGGT,AC185343.2,95.0,"Pan troglodytes BAC clone CH251-534A21 from chromosome x, complete sequence"
A00470:566:HF2L2DRX3:2:2160:15004:32487_ATTAGCAGGT,AC207444.4,93.75,"Homo sapiens FOSMID clone ABC9-44028100I2 from chromosome x, complete sequence"
A00470:566:HF2L2DRX3:2:2160:15004:32487_ATTAGCAGGT,BX842570.11,92.5,"Human DNA sequence from clone RP11-23N11 on chromosome X, complete sequence"
A00470:566:HF2L2DRX3:2:2160:3233:3020_TAAAGCCTGG,CP072262.1,100.0,Kocuria rhizophila strain 28R2A-20 chromosome
A00470:566:HF2L2DRX3:2:2160:3233:3020_TAAAGCCTGG,NR_076269.1,100.0,"Kocuria rhizophila strain DC2201 23S ribosomal RNA gene, complete sequence"
A00470:566:HF2L2DRX3:2:2160:3233:3020_TAAAGCCTGG,CP059343.1,100.0,"Kocuria varians strain 80 chromosome, complete genome"
A00470:566:HF2L2DRX3:2:2160:3233:3020_TAAAGCCTGG,AP009152.1,100.0,"Kocuria rhizophila DC2201 DNA, complete genome"
A00470:566:HF2L2DRX3:2:2160:3233:3020_TAAAGCCTGG,CP088298.1,97.143,"Brevibacterium zhoupengii strain HY170 chromosome, complete genome"
A00470:566:HF2L2DRX3:2:2127:22968:32753_AAATAGTAGC,CP089128.1,100.0,Saccharomyces cerevisiae strain S288C-SK1-cross isolate tetrad 8 spore a chromosome XII
A00470:566:HF2L2DRX3:2:2127:22968:32753_AAATAGTAGC,CP089111.1,100.0,Saccharomyces cerevisiae strain S288C-SK1-cross isolate tetrad 12 spore a chromosome XII
A00470:566:HF2L2DRX3:2:2127:22968:32753_AAATAGTAGC,CP088321.1,100.0,Saccharomyces cerevisiae strain F chromosome XII
A00470:566:HF2L2DRX3:2:2127:22968:32753_AAATAGTAGC,CP088312.1,100.0,Saccharomyces cerevisiae strain A chromosome XII
A00470:566:HF2L2DRX3:2:2127:22968:32753_AAATAGTAGC,LK021686.1,100.0,"Saccharomyces cerevisiae partial 18S rRNA gene, isolate 1"
A00470:566:HF2L2DRX3:2:2128:15438:19554_TCGCGCACTG,CP089445.1,100.0,"Escherichia coli strain 5-1 chromosome, complete genome"
A00470:566:HF2L2DRX3:2:2128:15438:19554_TCGCGCACTG,CP089304.1,100.0,"Pseudomonas sp. NIBR-H-19 chromosome, complete genome"
A00470:566:HF2L2DRX3:2:2128:15438:19554_TCGCGCACTG,OU701452.1,100.0,"Escherichia coli isolate CNR65D6 genome assembly, chromosome: 1"
A00470:566:HF2L2DRX3:2:2128:15438:19554_TCGCGCACTG,OU701449.1,100.0,"Escherichia coli isolate CNR85I8 genome assembly, chromosome: 1"
A00470:566:HF2L2DRX3:2:2128:15438:19554_TCGCGCACTG,CP087880.1,100.0,"Pseudocitrobacter corydidari isolate G163CM chromosome, complete genome"
A00470:566:HF2L2DRX3:2:2128:2329:18897_GGGGACGACA,CP086304.1,100.0,"Burkholderia ambifaria strain B21-004 chromosome 1, complete sequence"
A00470:566:HF2L2DRX3:2:2128:2329:18897_GGGGACGACA,CP086301.1,100.0,"Burkholderia sp. B21-005 chromosome 1, complete sequence"
A00470:566:HF2L2DRX3:2:2128:2329:18897_GGGGACGACA,CP086294.1,100.0,"Burkholderia sp. B21-007 chromosome 1, complete sequence"
A00470:566:HF2L2DRX3:2:2128:2329:18897_GGGGACGACA,HG938370.1,100.0,Burkholderia cenocepacia H111 chromosome 1 complete genome
A00470:566:HF2L2DRX3:2:2128:2329:18897_GGGGACGACA,CP082807.1,100.0,"Burkholderia contaminans strain SCAID TST1-2021 (11/270) chromosome 1, complete sequence"
A00470:566:HF2L2DRX3:2:2128:8784:16830_CCCCAACACG,MW884805.1,98.701,"Pseudomonadota bacterium strain IMCC27049 16S ribosomal RNA gene, partial sequence"
A00470:566:HF2L2DRX3:2:2128:8784:16830_CCCCAACACG,JX672770.1,98.701,"Uncultured archaeon clone 3S_003b_d07 16S ribosomal RNA gene, partial sequence"
A00470:566:HF2L2DRX3:2:2128:8784:16830_CCCCAACACG,JX672709.1,98.701,"Uncultured archaeon clone 3S_002a_MD1_E03 16S ribosomal RNA gene, partial sequence"
A00470:566:HF2L2DRX3:2:2128:8784:16830_CCCCAACACG,JX672397.1,98.701,"Uncultured archaeon clone 4S_003b_h11 16S ribosomal RNA gene, partial sequence"
A00470:566:HF2L2DRX3:2:2128:8784:16830_CCCCAACACG,JX672305.1,98.701,"Uncultured archaeon clone 4S_001b_f08 16S ribosomal RNA gene, partial sequence"
A00470:566:HF2L2DRX3:2:2128:9290:26850_AGGGCGGCCG,CP076413.1,100.0,"Ralstonia wenshanensis strain 56D2 chromosome, complete genome"
A00470:566:HF2L2DRX3:2:2128:9290:26850_AGGGCGGCCG,CP076412.1,100.0,"Ralstonia wenshanensis strain 56D2 plasmid p56D2, complete sequence"
A00470:566:HF2L2DRX3:2:2128:9290:26850_AGGGCGGCCG,OL813217.1,100.0,"Burkholderia sp. strain PSB3 16S ribosomal RNA gene, partial sequence"
A00470:566:HF2L2DRX3:2:2128:9290:26850_AGGGCGGCCG,OL813216.1,100.0,"Burkholderia sp. strain PSB1 16S ribosomal RNA gene, partial sequence"
A00470:566:HF2L2DRX3:2:2128:9290:26850_AGGGCGGCCG,CP088237.1,100.0,Ralstonia solanacearum strain UW251 chromosome
A00470:566:HF2L2DRX3:2:2129:11758:29371_TAGAGCGAGC,CP004384.1,100.0,"Burkholderia thailandensis USAMRU Malaysia #20 chromosome 2, complete sequence"
A00470:566:HF2L2DRX3:2:2129:11758:29371_TAGAGCGAGC,CP004383.1,100.0,"Burkholderia thailandensis USAMRU Malaysia #20 chromosome 1, complete sequence"
A00470:566:HF2L2DRX3:2:2129:11758:29371_TAGAGCGAGC,HG938371.2,100.0,"Burkholderia cenocepacia H111 chromosome 2, complete genome"
A00470:566:HF2L2DRX3:2:2129:11758:29371_TAGAGCGAGC,CP086306.1,100.0,"Burkholderia ambifaria strain B21-004 chromosome 3, complete sequence"
A00470:566:HF2L2DRX3:2:2129:11758:29371_TAGAGCGAGC,CP086305.1,100.0,"Burkholderia ambifaria strain B21-004 chromosome 2, complete sequence"
A00470:566:HF2L2DRX3:2:2129:16414:29418_GATCACTGAG,CP088285.1,100.0,"Bradyrhizobium septentrionale strain 1S1 chromosome, complete genome"
A00470:566:HF2L2DRX3:2:2129:16414:29418_GATCACTGAG,CP088288.1,100.0,"Bradyrhizobium septentrionale strain 162S2 chromosome, complete genome"
A00470:566:HF2L2DRX3:2:2129:16414:29418_GATCACTGAG,CP088282.1,100.0,"Bradyrhizobium quebecense strain 12S5 chromosome, complete genome"
A00470:566:HF2L2DRX3:2:2129:16414:29418_GATCACTGAG,CP088280.1,100.0,"Bradyrhizobium barranii subsp. barranii strain 323S2 chromosome, complete genome"
A00470:566:HF2L2DRX3:2:2129:16414:29418_GATCACTGAG,CP088022.1,100.0,"Bradyrhizobium quebecense strain 66S1MB chromosome, complete genome"
A00470:566:HF2L2DRX3:2:2129:8377:35321_CGTCCCCCAG,CP004384.1,100.0,"Burkholderia thailandensis USAMRU Malaysia #20 chromosome 2, complete sequence"
A00470:566:HF2L2DRX3:2:2129:8377:35321_CGTCCCCCAG,CP004383.1,100.0,"Burkholderia thailandensis USAMRU Malaysia #20 chromosome 1, complete sequence"
A00470:566:HF2L2DRX3:2:2129:8377:35321_CGTCCCCCAG,AP014576.1,100.0,"Burkholderia sp. RPE67 DNA, complete genome, chromosome: 1"
A00470:566:HF2L2DRX3:2:2129:8377:35321_CGTCCCCCAG,HG938371.2,100.0,"Burkholderia cenocepacia H111 chromosome 2, complete genome"
A00470:566:HF2L2DRX3:2:2129:8377:35321_CGTCCCCCAG,CP086306.1,100.0,"Burkholderia ambifaria strain B21-004 chromosome 3, complete sequence"
A00470:566:HF2L2DRX3:2:2130:6361:7748_CCGCGATGAC,CP078509.1,98.75,"Stutzerimonas stutzeri strain S116 chromosome, complete genome"
A00470:566:HF2L2DRX3:2:2130:6361:7748_CCGCGATGAC,CP078087.1,98.75,"Stutzerimonas stutzeri strain YWX-1 chromosome, complete genome"
A00470:566:HF2L2DRX3:2:2130:6361:7748_CCGCGATGAC,NR_103974.1,98.75,"Pseudomonas stutzeri strain ATCC 17588 23S ribosomal RNA gene, complete sequence"
A00470:566:HF2L2DRX3:2:2130:6361:7748_CCGCGATGAC,AP024722.1,98.75,"Pseudomonas stutzeri F2a DNA, complete genome"
A00470:566:HF2L2DRX3:2:2130:6361:7748_CCGCGATGAC,LC515965.1,98.75,"Pseudomonas stutzeri ATCC 17588 = LMG 11199 23S ribosomal RNA, partial sequence"
A00470:566:HF2L2DRX3:2:2165:13612:25034_AACGGATCCA,NR_075323.1,97.917,"Shigella boydii Sb227 strain Sb227 5S ribosomal RNA, complete sequence"
A00470:566:HF2L2DRX3:2:2165:13612:25034_AACGGATCCA,CP068090.1,97.917,"Shigella boydii strain FDAARGOS_1139 chromosome, complete genome"
A00470:566:HF2L2DRX3:2:2165:13612:25034_AACGGATCCA,CP049285.1,97.917,"Shigella boydii strain 602068 chromosome, complete genome"
A00470:566:HF2L2DRX3:2:2165:13612:25034_AACGGATCCA,CP000036.1,97.917,"Shigella boydii Sb227, complete genome"
A00470:566:HF2L2DRX3:2:1273:31006:34929_GATGGCAACG,CP089132.1,100.0,Saccharomyces cerevisiae strain S288C-SK1-cross isolate tetrad 8 spore a chromosome XVI
A00470:566:HF2L2DRX3:2:1273:31006:34929_GATGGCAACG,CP089131.1,100.0,Saccharomyces cerevisiae strain S288C-SK1-cross isolate tetrad 8 spore a chromosome XV
A00470:566:HF2L2DRX3:2:1273:31006:34929_GATGGCAACG,CP089129.1,100.0,Saccharomyces cerevisiae strain S288C-SK1-cross isolate tetrad 8 spore a chromosome XIII
A00470:566:HF2L2DRX3:2:1273:31006:34929_GATGGCAACG,CP089126.1,100.0,Saccharomyces cerevisiae strain S288C-SK1-cross isolate tetrad 8 spore a chromosome X
A00470:566:HF2L2DRX3:2:1273:31006:34929_GATGGCAACG,CP089123.1,100.0,Saccharomyces cerevisiae strain S288C-SK1-cross isolate tetrad 8 spore a chromosome VII
A00470:566:HF2L2DRX3:2:1274:20491:19445_ATTAAATCGG,CP089129.1,100.0,Saccharomyces cerevisiae strain S288C-SK1-cross isolate tetrad 8 spore a chromosome XIII
A00470:566:HF2L2DRX3:2:1274:20491:19445_ATTAAATCGG,CP089128.1,100.0,Saccharomyces cerevisiae strain S288C-SK1-cross isolate tetrad 8 spore a chromosome XII
A00470:566:HF2L2DRX3:2:1274:20491:19445_ATTAAATCGG,CP089127.1,100.0,Saccharomyces cerevisiae strain S288C-SK1-cross isolate tetrad 8 spore a chromosome XI
A00470:566:HF2L2DRX3:2:1274:20491:19445_ATTAAATCGG,CP089126.1,100.0,Saccharomyces cerevisiae strain S288C-SK1-cross isolate tetrad 8 spore a chromosome X
A00470:566:HF2L2DRX3:2:1274:20491:19445_ATTAAATCGG,CP089124.1,100.0,Saccharomyces cerevisiae strain S288C-SK1-cross isolate tetrad 8 spore a chromosome VIII
A00470:566:HF2L2DRX3:2:2132:13015:6809_AGTCTGCCAG,CP089448.1,98.75,"Klebsiella michiganensis strain 8-1 chromosome, complete genome"
A00470:566:HF2L2DRX3:2:2132:13015:6809_AGTCTGCCAG,CP089445.1,98.75,"Escherichia coli strain 5-1 chromosome, complete genome"
A00470:566:HF2L2DRX3:2:2132:13015:6809_AGTCTGCCAG,CP089385.1,98.75,"Klebsiella variicola subsp. variicola strain KPN692 chromosome, complete genome"
A00470:566:HF2L2DRX3:2:2132:13015:6809_AGTCTGCCAG,CP089315.1,98.75,"Klebsiella michiganensis strain K92 chromosome, complete genome"
A00470:566:HF2L2DRX3:2:2132:13015:6809_AGTCTGCCAG,CP089313.1,98.75,"Salmonella enterica subsp. enterica serovar Indiana strain YZ21MCS4 chromosome, complete genome"
A00470:566:HF2L2DRX3:2:2132:2311:24189_GAAATTGGTT,CP083452.1,100.0,"Comamonas odontotermitis strain WLL plasmid unnamed1, complete sequence"
A00470:566:HF2L2DRX3:2:2132:2311:24189_GAAATTGGTT,CP083451.1,100.0,"Comamonas odontotermitis strain WLL chromosome, complete genome"
A00470:566:HF2L2DRX3:2:2132:2311:24189_GAAATTGGTT,CP072916.1,100.0,"Comamonas aquatica strain NEB418 chromosome, complete genome"
A00470:566:HF2L2DRX3:2:2132:2311:24189_GAAATTGGTT,CP049139.1,100.0,"Herbaspirillum frisingense strain IAC152 chromosome, complete genome"
A00470:566:HF2L2DRX3:2:2132:2311:24189_GAAATTGGTT,CP058554.1,100.0,Comamonas piscis strain BIGb0172 chromosome
A00470:566:HF2L2DRX3:2:2132:24831:19006_TTAAATGACT,AB050734.1,100.0,"Rhodobacter blasticus gene for 23S ribosomal RNA, partial sequence"
A00470:566:HF2L2DRX3:2:2132:24831:19006_TTAAATGACT,CP069370.1,98.734,"Neotabrizicola shimadae strain N10 chromosome, complete genome"
A00470:566:HF2L2DRX3:2:2132:24831:19006_TTAAATGACT,CP059262.1,98.734,MAG: Exiguobacterium profundum isolate SSD5 chromosome
A00470:566:HF2L2DRX3:2:2132:24831:19006_TTAAATGACT,CP000144.2,97.468,"Rhodobacter sphaeroides 2.4.1 chromosome 2, complete sequence"
A00470:566:HF2L2DRX3:2:2132:24831:19006_TTAAATGACT,CP000143.2,97.468,"Rhodobacter sphaeroides 2.4.1 chromosome 1, complete sequence"
A00470:566:HF2L2DRX3:2:2133:7509:31313_AGGAAGGAAG,XR_001492364.2,100.0,"PREDICTED: Macaca fascicularis uncharacterized LOC107130378 (LOC107130378), ncRNA"
